-98.524,32.118,DELE/De Leon Community Park  TYPE:CP PH:254.893.2065     AMEN:WES DP FT DW  LON/LAT:-98.524/32.118,DELE,De Leon Community Park,CP,254.893.2065, , , , ,WES DP FT DW 
-85.618,34.501,DESO/De Soto State Park  TYPE:SP PH:256.845.5075 OPEN:all year  SITES:94 EL:1469 AMEN:WES DP 60ft SH RS  LON/LAT:-85.618/34.501,DESO,De Soto State Park,SP,256.845.5075,all year, ,94,1469,WES DP 60ft SH RS 
-85.2,30.142,DEAD/Dead Lakes State Rec Area  TYPE:SP      AMEN:E DP DW SH NR L$  LON/LAT:-85.2/30.142,DEAD,Dead Lakes State Rec Area,SP, , , , , ,E DP DW SH NR L$ 
-94.475,32.045,DECK/Decker Hill Park - Lake Murvaul  TYPE:UTIL PH:903.693.6562 OPEN:all year    AMEN:NH ND NS N$  LON/LAT:-94.475/32.045,DECK,Decker Hill Park - Lake Murvaul,UTIL,903.693.6562,all year, , , ,NH ND NS N$ 
-83.436,35.461,DEEP/Deep Creek - Great Smoky Mountains  TYPE:NP PH:865.436.1200 OPEN:mid apr-mid oct  SITES:92 EL:1808 AMEN:NH ND 26ft DW NS NR  LON/LAT:-83.436/35.461,DEEP,Deep Creek - Great Smoky Mountains,NP,865.436.1200,mid apr-mid oct, ,92,1808,NH ND 26ft DW NS NR 
-95.587,35.399,DEEP/Deep Fork - Lake Eufaula State Park  TYPE:SP PH:918.689.5311 OPEN:all year COMM:beautiful   AMEN:WES DW SH  LON/LAT:-95.587/35.399,DEEP,Deep Fork - Lake Eufaula State Park,SP,918.689.5311,all year,beautiful, , ,WES DW SH 
-84.14,34.74,DEEP/Deep Hole  TYPE:NF PH:706.632.3031/770.297.3000   SITES:18 EL:1985 AMEN:NH ND NS NR  LON/LAT:-84.14/34.74,DEEP,Deep Hole,NF,706.632.3031/770.297.3000, , ,18,1985,NH ND NS NR 
-80.086,35.403,DEEW/Deep Water Camp  TYPE:NF PH:910.576.6391/828.257.4200   SITES:6  AMEN:NH ND NS NR  LON/LAT:-80.086/35.403,DEEW,Deep Water Camp,NF,910.576.6391/828.257.4200, , ,6, ,NH ND NS NR 
-87.435,33.257,DEER/Deerlick  TYPE:COE PH:205.759.1591 OPEN:early mar-late nov  SITES:46  AMEN:WE DP DW SH RS PA  LON/LAT:-87.435/33.257,DEER,Deerlick,COE,205.759.1591,early mar-late nov, ,46, ,WE DP DW SH RS PA 
-85.91,36.299,DEFE/Defeated Creek  TYPE:COE PH:615.774.3141 OPEN:mid mar-late oct    AMEN:WES DP DW SH RS PA  LON/LAT:-85.91/36.299,DEFE,Defeated Creek,COE,615.774.3141,mid mar-late oct, , , ,WES DP DW SH RS PA 
-93.164,34.301,DEGR/DeGray Lake State Park  TYPE:SP PH:501 865.2801 OPEN:all year    AMEN:E DP SH RS  LON/LAT:-93.164/34.301,DEGR,DeGray Lake State Park,SP,501 865.2801,all year, , , ,E DP SH RS 
-85.807,34.577,DEKA/Dekalb County Public Lake  TYPE:CP PH:256.657.1300 OPEN:all year   EL:1281 AMEN:E ND NS L$  LON/LAT:-85.807/34.577,DEKA,Dekalb County Public Lake,CP,256.657.1300,all year, , ,1281,E ND NS L$ 
-93.275,35.297,DELA/Delaware Park        AMEN:NH ND NS L$  LON/LAT:-93.275/35.297,DELA,Delaware Park, , , , , , ,NH ND NS L$ 
-93.489,34.547,DENB/Denby Point - Lake Ouachita  TYPE:COE PH:501.767.2108 OPEN:early may-late sep  SITES:67  AMEN:E DP FT DW SH RS PA L$  LON/LAT:-93.489/34.547,DENB,Denby Point - Lake Ouachita,COE,501.767.2108,early may-late sep, ,67, ,E DP FT DW SH RS PA L$ 
-82.11,36.257,DENN/Dennis Cove Rec Area  TYPE:NF PH:423.735.1500/423.476.9700   SITES:20 EL:2579 AMEN:NH NR  LON/LAT:-82.11/36.257,DENN,Dennis Cove Rec Area,NF,423.735.1500/423.476.9700, , ,20,2579,NH NR 
-83.912,34.71,DESO/Desoto Falls  TYPE:NF PH:706.745.6928/770.297.3000   SITES:44 EL:2130 AMEN:NH DW SH NR  LON/LAT:-83.912/34.71,DESO,Desoto Falls,NF,706.745.6928/770.297.3000, , ,44,2130,NH DW SH NR 
-86.499,30.411,DEST/Destin Army Infantry Center Military  TYPE:MIL PH:850.837.6423 OPEN:all year COMM:military only - do not use our lat/lon - contact them for directions and info SITES:46  AMEN:WE DP FT DW SH RS  LON/LAT:-86.499/30.411,DEST,Destin Army Infantry Center Military,MIL,850.837.6423,all year,military only - do not use our lat/lon - contact them for directions and info,46, ,WE DP FT DW SH RS 
-87.455,36.656,DEST/Destiny Parks Military - Fort Campbell  TYPE:MIL PH:270.798.2175  COMM:military only - do not use our lat/lon - contact them for directions and info   AMEN:RS  LON/LAT:-87.455/36.656,DEST,Destiny Parks Military - Fort Campbell,MIL,270.798.2175, ,military only - do not use our lat/lon - contact them for directions and info, , ,RS 
-94.25,35.782,DEVI/Devils Den State Park  TYPE:SP PH:479.761.3325 OPEN:all year   EL:1048 AMEN:E DP SH RS  LON/LAT:-94.25/35.782,DEVI,Devils Den State Park,SP,479.761.3325,all year, , ,1048,E DP SH RS 
-87.964,36.795,DEVI/Devils Elbow Recreation Area  TYPE:COE PH:270.924.5878     AMEN:E NR  LON/LAT:-87.964/36.795,DEVI,Devils Elbow Recreation Area,COE,270.924.5878, , , , ,E NR 
-92.177,35.584,DEVF/Devils Fork - Greers Ferry Lake  TYPE:COE PH:501.825.8618 OPEN:early apr-late oct    AMEN:E DP DW SH RS  LON/LAT:-92.177/35.584,DEVF,Devils Fork - Greers Ferry Lake,COE,501.825.8618,early apr-late oct, , , ,E DP DW SH RS 
-82.951,34.952,DEVI/Devils Fork State Park  TYPE:SP PH:864.944.2639 OPEN:all year  SITES:85 EL:1085 AMEN:E DP DW SH RS PA  LON/LAT:-82.951/34.952,DEVI,Devils Fork State Park,SP,864.944.2639,all year, ,85,1085,E DP DW SH RS PA 
-88.471,33.601,DEWA/Dewayne Hayes  TYPE:COE PH:662.434.6939 OPEN:all year    AMEN:WES DP DW SH RS PA  LON/LAT:-88.471/33.601,DEWA,Dewayne Hayes,COE,662.434.6939,all year, , , ,WES DP DW SH RS PA 
-97.814,32.246,DINO/Dinosaur Valley State Park  TYPE:SP PH:254.897.4588 OPEN:all year  SITES:46  AMEN:E DP DW SH RS  LON/LAT:-97.814/32.246,DINO,Dinosaur Valley State Park,SP,254.897.4588,all year, ,46, ,E DP DW SH RS 
-95.013,36.483,DISN/Disney / Little Blue State Park  TYPE:SP PH:918.435.8066 OPEN:all year COMM:dupe   LON/LAT:-95.013/36.483,DISN,Disney / Little Blue State Park,SP,918.435.8066,all year,dupe, , ,
-86.558,34.575,DITT/Ditto Landing City Campground  TYPE:CP PH:256.883.9420     AMEN:NH  LON/LAT:-86.558/34.575,DITT,Ditto Landing City Campground,CP,256.883.9420, , , , ,NH 
-89.896,31.979,DLOW/DLo Water Park  TYPE:CP PH:601.847.4310     AMEN:WES DP DW SH  LON/LAT:-89.896/31.979,DLOW,DLo Water Park,CP,601.847.4310, , , , ,WES DP DW SH 
-84.522,33.922,DOBB/Dobbins Lakeside Military  TYPE:MIL PH:678.655.4870  COMM:military only - do not use our lat/lon - contact them for directions and info   AMEN:RS  LON/LAT:-84.522/33.922,DOBB,Dobbins Lakeside Military,MIL,678.655.4870, ,military only - do not use our lat/lon - contact them for directions and info, , ,RS 
-99.775,36.828,DOBY/Doby Springs Park  TYPE:CP PH:580.735.2654  COMM:unknown facilities SITES:18  AMEN:E  LON/LAT:-99.775/36.828,DOBY,Doby Springs Park,CP,580.735.2654, ,unknown facilities,18, ,E 
-83.975,34.674,DOCK/Dockery Lake  TYPE:NF PH:706.745.6928/770.297.3000   SITES:18 EL:2384 AMEN:NH NR  LON/LAT:-83.975/34.674,DOCK,Dockery Lake,NF,706.745.6928/770.297.3000, , ,18,2384,NH NR 
-95.664,33.348,DOCT/Doctors Creek - Cooper Lake State Park  TYPE:SP PH:903.395.3100 OPEN:all year  SITES:40  AMEN:E DP DW SH RS  LON/LAT:-95.664/33.348,DOCT,Doctors Creek - Cooper Lake State Park,SP,903.395.3100,all year, ,40, ,E DP DW SH RS 
-104.834,31.994,DOGC/Dog Canyon  - Guadalupe Mountains National Park  TYPE:NP PH:505.981.2418   SITES:9 EL:6302 AMEN:NH NR  LON/LAT:-104.834/31.994,DOGC,Dog Canyon  - Guadalupe Mountains National Park,NP,505.981.2418, , ,9,6302,NH NR 
-86.131,37.319,DOGC/Dog Creek - Nolin River Lake  TYPE:COE PH:270.524.5454 OPEN:early may-mid sep  SITES:70  AMEN:WE DP DW SH RS PA  LON/LAT:-86.131/37.319,DOGC,Dog Creek - Nolin River Lake,COE,270.524.5454,early may-mid sep, ,70, ,WE DP DW SH RS PA 
-93.193,31.492,DOGW/Dogwood  Complex  TYPE:NF PH:318.472.1840/318.471.7160 OPEN:all year  SITES:12  AMEN:NH NR N$  LON/LAT:-93.193/31.492,DOGW,Dogwood  Complex,NF,318.472.1840/318.471.7160,all year, ,12, ,NH NR N$ 
-93.833,35.401,DOGW/Dogwood Drive - Lake Eufaula State Park  TYPE:SP PH:918.689.5311 OPEN:all year    AMEN:SH  LON/LAT:-93.833/35.401,DOGW,Dogwood Drive - Lake Eufaula State Park,SP,918.689.5311,all year, , , ,SH 
-95.143,33.051,DOGW/Dogwood Park  TYPE:CP   COMM:swim    AMEN:WE DP FT DW SH  LON/LAT:-95.143/33.051,DOGW,Dogwood Park,CP, , ,swim , , ,WE DP FT DW SH 
-84.622,34.61,DOLL/Doll Mountain  TYPE:COE PH:706.276.4413 OPEN:early apr-late oct   EL:1192 AMEN:WE DP DW SH RS PA  LON/LAT:-84.622/34.61,DOLL,Doll Mountain,COE,706.276.4413,early apr-late oct, , ,1192,WE DP DW SH RS PA 
-80.504,27.817,DONA/Donald MacDonald Campgrounds  TYPE:CP PH:772.589.0087   SITES:29  AMEN:NH ND DW SH  LON/LAT:-80.504/27.817,DONA,Donald MacDonald Campgrounds,CP,772.589.0087, , ,29, ,NH ND DW SH 
-98.644,34.718,DORI/Doris Campground - Wichita Mts NWR  TYPE:USFW PH:580.429.3222 OPEN:all year COMM:camping only for those engaged in wildlife activities   AMEN:E DP FT DW SH NR  LON/LAT:-98.644/34.718,DORI,Doris Campground - Wichita Mts NWR,USFW,580.429.3222,all year,camping only for those engaged in wildlife activities, , ,E DP FT DW SH NR 
-94.631,29.679,DOBA/Double Bayou County Park  TYPE:CP PH:409.267.8345     AMEN:NH ND NS L$  LON/LAT:-94.631/29.679,DOBA,Double Bayou County Park,CP,409.267.8345, , , , ,NH ND NS L$ 
-84.089,35.419,DOUB/Double Camp/Citgo Creek  TYPE:NF PH:423.253.8400/423.476.9700   SITES:50 EL:1478 AMEN:NR  LON/LAT:-84.089/35.419,DOUB,Double Camp/Citgo Creek,NF,423.253.8400/423.476.9700, , ,50,1478,NR 
-95.133,30.553,DOUB/Double Lake  TYPE:NF PH:936.344.6205/936.639.8501 OPEN:all year  SITES:74  AMEN:WES ND DW SH RS PA  LON/LAT:-95.133/30.553,DOUB,Double Lake,NF,936.344.6205/936.639.8501,all year, ,74, ,WES ND DW SH RS PA 
-81.184,36.422,DOUG/Doughton Park  - Blue Ridge Parkway  TYPE:NP PH:828.298.0398    EL:3689 AMEN:NH DP NR  LON/LAT:-81.184/36.422,DOUG,Doughton Park  - Blue Ridge Parkway,NP,828.298.0398, , , ,3689,NH DP NR 
-83.536,35.957,DOUH/Douglas Dam Headwater  TYPE:TVA PH:865.632.3791 OPEN:mid mar-mid dec  SITES:65 EL:1038 AMEN:WE DP DW SH NR  LON/LAT:-83.536/35.957,DOUH,Douglas Dam Headwater,TVA,865.632.3791,mid mar-mid dec, ,65,1038,WE DP DW SH NR 
-83.552,35.955,DOUT/Douglas Dam Tailwater  TYPE:TVA PH:865.632.3791 OPEN:mid mar-mid dec  SITES:62  AMEN:WE DP DW SH NR  LON/LAT:-83.552/35.955,DOUT,Douglas Dam Tailwater,TVA,865.632.3791,mid mar-mid dec, ,62, ,WE DP DW SH NR 
-92.262,34.752,DOWN/Downtown Riverside RV Park  TYPE:CP PH:501.340.5312   SITES:69  AMEN:WES DP DW SH  LON/LAT:-92.262/34.752,DOWN,Downtown Riverside RV Park,CP,501.340.5312, , ,69, ,WES DP DW SH 
-93.633,34.644,DRAG/Dragover  TYPE:NF PH:479.394.5595/501.321.5202 OPEN:all year  SITES:7  AMEN:NH ND VT NW NS NR N$  LON/LAT:-93.633/34.644,DRAG,Dragover,NF,479.394.5595/501.321.5202,all year, ,7, ,NH ND VT NW NS NR N$ 
-81.404,34.085,DREH/Dreher Island State Rec Area  TYPE:SP PH:803.364.4152 OPEN:all year  SITES:110  AMEN:E DP DW SH RS PA  LON/LAT:-81.404/34.085,DREH,Dreher Island State Rec Area,SP,803.364.4152,all year, ,110, ,E DP DW SH RS PA 
-89.726,31.75,DRYC/Dry Creek Water Park  TYPE:AUTH PH:601.797.4619     AMEN:DW SH  LON/LAT:-89.726/31.75,DRYC,Dry Creek Water Park,AUTH,601.797.4619, , , , ,DW SH 
-90.113,34.774,DUBP/Dub Patton - Arkabutla Lake  TYPE:COE PH:662.562.6261 OPEN:all year    AMEN:E DP DW SH RS  LON/LAT:-90.113/34.774,DUBP,Dub Patton - Arkabutla Lake,COE,662.562.6261,all year, , , ,E DP DW SH RS 
-98.344,32.086,DUBL/Dublin City Park  TYPE:CP    SITES:8  AMEN:WE  LON/LAT:-98.344/32.086,DUBL,Dublin City Park,CP, , , ,8, ,WE 
-93.435,35.341,DUBL/Dublin Park        LON/LAT:-93.435/35.341,DUBL,Dublin Park, , , , , , ,
-83.929,34.312,DUCK/Duckett Mill  TYPE:COE PH:770.532.9802 OPEN:mid apr-late aug   EL:1156 AMEN:WE DP DW SH RS PA  LON/LAT:-83.929/34.312,DUCK,Duckett Mill,COE,770.532.9802,mid apr-late aug, , ,1156,WE DP DW SH RS PA 
-97.111,34.108,DUKE/Dukes - Lake Murray State Park  TYPE:SP PH:580.223.4044 OPEN:all year    AMEN:DP SH  LON/LAT:-97.111/34.108,DUKE,Dukes - Lake Murray State Park,SP,580.223.4044,all year, , , ,DP SH 
-88.822,32.229,DUNN/Dunns Falls Water Park  TYPE:AUTH PH:601.655.8550     AMEN:NH  LON/LAT:-88.822/32.229,DUNN,Dunns Falls Water Park,AUTH,601.655.8550, , , , ,NH 
-82.466,27.739,EGSI/E G Simmons County Park  TYPE:CP PH:813.671.7655     AMEN:E DP DW SH  LON/LAT:-82.466/27.739,EGSI,E G Simmons County Park,CP,813.671.7655, , , , ,E DP DW SH 
-81.55,30.772,EAGL/Eagle Hammock RV Military - Kings Bay NSB  TYPE:MIL PH:912.673.1161  COMM:military only - do not use our lat/lon - contact them for directions and info   AMEN:RS  LON/LAT:-81.55/30.772,EAGL,Eagle Hammock RV Military - Kings Bay NSB,MIL,912.673.1161, ,military only - do not use our lat/lon - contact them for directions and info, , ,RS 
-84.594,30.901,EARL/Earl May Boat Basin  TYPE:CP PH:229.248.2010   SITES:10  AMEN:E DP DW SH  LON/LAT:-84.594/30.901,EARL,Earl May Boat Basin,CP,229.248.2010, , ,10, ,E DP DW SH 
-93.973,32.727,EARL/Earl Williamson Park  TYPE:CP PH:318.995.7139     AMEN:E DW SH  LON/LAT:-93.973/32.727,EARL,Earl Williamson Park,CP,318.995.7139, , , , ,E DW SH 
-87.389,32.116,EAST/East Bank/Millers Ferry  TYPE:COE PH:334.682.4191     AMEN:WE NR  LON/LAT:-87.389/32.116,EAST,East Bank/Millers Ferry,COE,334.682.4191, , , , ,WE NR 
-100.864,35.212,EASB/East Bluff - Lake McClellan  TYPE:NF PH:580.497.2143/505.346.3804   SITES:30 EL:2943 AMEN:NR  LON/LAT:-100.864/35.212,EASB,East Bluff - Lake McClellan,NF,580.497.2143/505.346.3804, , ,30,2943,NR 
-95.922,33.735,EASL/East Lake Davy Crockett  TYPE:NF PH:940.627.5475/936.639.8501   SITES:14  AMEN:NH NR  LON/LAT:-95.922/33.735,EASL,East Lake Davy Crockett,NF,940.627.5475/936.639.8501, , ,14, ,NH NR 
-79.958,35.44,EASM/East Morris Mountain  TYPE:NF      AMEN:NH ND NS NR N$  LON/LAT:-79.958/35.44,EASM,East Morris Mountain,NF, , , , , ,NH ND NS NR N$ 
-98.487,34.751,EASL/East Side - Lake Lawtonka  TYPE:CP PH:580.529.2663   SITES:35  AMEN:E DP DW SH  LON/LAT:-98.487/34.751,EASL,East Side - Lake Lawtonka,CP,580.529.2663, , ,35, ,E DP DW SH 
-84.851,30.718,EAST/Eastbank - Lake Seminole  TYPE:COE PH:229.662.9273 OPEN:all year  SITES:40  AMEN:WE DP DW SH RS L$  LON/LAT:-84.851/30.718,EAST,Eastbank - Lake Seminole,COE,229.662.9273,all year, ,40, ,WE DP DW SH RS L$ 
-86.684,34.588,EAST/Easter Posey MWR Military - Redstone Arsenal  TYPE:MIL PH:256.876.4868  COMM:military only - do not use our lat/lon - contact them for directions and info   AMEN:RS  LON/LAT:-86.684/34.588,EAST,Easter Posey MWR Military - Redstone Arsenal,MIL,256.876.4868, ,military only - do not use our lat/lon - contact them for directions and info, , ,RS 
-80.16,26.172,EASP/Easterlin Park  TYPE:CP PH:954.357.5190     AMEN:WES DP FT DW SH  LON/LAT:-80.16/26.172,EASP,Easterlin Park,CP,954.357.5190, , , , ,WES DP FT DW SH 
-94.126,31.07,EBEN/Ebenezer - Sam Rayburn Reservoir  TYPE:COE PH:409.384.5716 OPEN:all year  SITES:30  AMEN:WE DP NS RS PA L$  LON/LAT:-94.126/31.07,EBEN,Ebenezer - Sam Rayburn Reservoir,COE,409.384.5716,all year, ,30, ,WE DP NS RS PA L$ 
-81.044,35.025,EBEN/Ebenezer County Park  TYPE:CP PH:803.366.6620   SITES:69  AMEN:WE DP DW SH  LON/LAT:-81.044/35.025,EBEN,Ebenezer County Park,CP,803.366.6620, , ,69, ,WE DP DW SH 
-88.023,37.005,EDDY/Eddy Creek Access - DFWR  TYPE:SFW  OPEN:early may-late sep COMM:Fish/Wildlife sites may have few facilitiies   AMEN:NH ND VT NS NR N$  LON/LAT:-88.023/37.005,EDDY,Eddy Creek Access - DFWR,SFW, ,early may-late sep,Fish/Wildlife sites may have few facilitiies, , ,NH ND VT NS NR N$ 
-85.832,36.08,EDGA/Edgar Evins State Park  TYPE:SP PH:931.858.2446 OPEN:all year  SITES:60  AMEN:E NR  LON/LAT:-85.832/36.08,EDGA,Edgar Evins State Park,SP,931.858.2446,all year, ,60, ,E NR 
-98.371,34.826,EDGE/Edgewater Park - Lawton  TYPE:CP PH:580.529.2663     AMEN:E  LON/LAT:-98.371/34.826,EDGE,Edgewater Park - Lawton,CP,580.529.2663, , , , ,E 
-93.129,34.256,EDGE/Edgewood - De Gray Lake  TYPE:COE PH:870.246.5501 OPEN:all year  SITES:51  AMEN:E DP FT DW SH RS PA  LON/LAT:-93.129/34.256,EDGE,Edgewood - De Gray Lake,COE,870.246.5501,all year, ,51, ,E DP FT DW SH RS PA 
-80.297,32.504,EDIS/Edisto Beach State Park  TYPE:SP PH:843.869.2756 OPEN:all year  SITES:115  AMEN:E DP DW SH RS PA  LON/LAT:-80.297/32.504,EDIS,Edisto Beach State Park,SP,843.869.2756,all year, ,115, ,E DP DW SH RS PA 
-82.16,27.928,EDWA/Edward Medard  TYPE:CP PH:813.757.3802     AMEN:E DP DW SH NR L$  LON/LAT:-82.16/27.928,EDWA,Edward Medard,CP,813.757.3802, , , , ,E DP DW SH NR L$ 
-86.53,30.46,EGLI/Eglin AFB Military  TYPE:MIL PH:850.883.1243  COMM:2 camps - military only - do not use our lat/lon - contact them for directions and info   AMEN:RS  LON/LAT:-86.53/30.46,EGLI,Eglin AFB Military,MIL,850.883.1243, ,2 camps - military only - do not use our lat/lon - contact them for directions and info, , ,RS 
-96.6,33.81,EISE/Eisenhower State Park  TYPE:SP PH:903.465.1956 OPEN:all year  SITES:215  AMEN:E DP SH RS  LON/LAT:-96.6/33.81,EISE,Eisenhower State Park,SP,903.465.1956,all year, ,215, ,E DP SH RS 
-97.1,34.092,ELEP/Elephant Rock - Lake Murray State Park  TYPE:SP PH:580.223.4044 OPEN:all year    AMEN:DP DW SH  LON/LAT:-97.1/34.092,ELEP,Elephant Rock - Lake Murray State Park,SP,580.223.4044,all year, , , ,DP DW SH 
-82.403,33.854,ELIJ/Elijah Clark State Park  TYPE:SP PH:706.359.3458 OPEN:all year    AMEN:E DP DW SH RS  LON/LAT:-82.403/33.854,ELIJ,Elijah Clark State Park,SP,706.359.3458,all year, , , ,E DP DW SH RS 
-76.18,36.27,ELIZ/Elizabeth City Lodging Military  TYPE:MIL PH:252.335.6482 OPEN:all year COMM:military only - do not use our lat/lon - contact them for directions and info SITES:14  AMEN:E DP NS RS  LON/LAT:-76.18/36.27,ELIZ,Elizabeth City Lodging Military,MIL,252.335.6482,all year,military only - do not use our lat/lon - contact them for directions and info,14, ,E DP NS RS 
-99.416,35.366,ELKL/Elk City Lake Park  TYPE:CP PH:580.225.3990   SITES:5  AMEN:WE L$  LON/LAT:-99.416/35.366,ELKL,Elk City Lake Park,CP,580.225.3990, , ,5, ,WE L$ 
-94.903,35.751,ELKC/Elk Creek Landing - Tenkiller Ferry Lake  TYPE:COE PH:918.487.5252 OPEN:all year    AMEN:E DP DW NS RS  LON/LAT:-94.903/35.751,ELKC,Elk Creek Landing - Tenkiller Ferry Lake,COE,918.487.5252,all year, , , ,E DP DW NS RS 
-83.586,35.659,ELKM/Elkmont - Great Smoky Mountains  TYPE:NP PH:865.436.1271 OPEN:mid may-late nov  SITES:220 EL:2170 AMEN:NH DP 35ft DW NS RS PA  LON/LAT:-83.586/35.659,ELKM,Elkmont - Great Smoky Mountains,NP,865.436.1271,mid may-late nov, ,220,2170,NH DP 35ft DW NS RS PA 
-87.966,34.448,ELLI/Elliot Branch - Bear Creek  Auth  TYPE:AUTH PH:256.332.4392   SITES:160  AMEN:E DP SH  LON/LAT:-87.966/34.448,ELLI,Elliot Branch - Bear Creek  Auth,AUTH,256.332.4392, , ,160, ,E DP SH 
-94.317,33.405,ELLI/Elliott Lake Military - Red River  TYPE:MIL PH:903.334.2254  COMM:military only - do not use our lat/lon - contact them for directions and info   AMEN:RS  LON/LAT:-94.317/33.405,ELLI,Elliott Lake Military - Red River,MIL,903.334.2254, ,military only - do not use our lat/lon - contact them for directions and info, , ,RS 
-95.599,35.014,ELMP/Elm Point - Eufaula Lake  TYPE:COE PH:918.484.5135     AMEN:E DP NS NR  LON/LAT:-95.599/35.014,ELMP,Elm Point - Eufaula Lake,COE,918.484.5135, , , , ,E DP NS NR 
-79.47,33.199,ELMW/Elmwood  TYPE:NF PH:/803.561.4000 OPEN:all year COMM:no tables   AMEN:NH ND VT DW NS NR N$  LON/LAT:-79.47/33.199,ELMW,Elmwood,NF,/803.561.4000,all year,no tables, , ,NH ND VT DW NS NR N$ 
-88.678,34.26,ELVI/Elvis Presley Lake  TYPE:SFW PH:662.840.5172  COMM:Natchez Trace MP 264.9 SITES:16  AMEN:WE FT DW NR  LON/LAT:-88.678/34.26,ELVI,Elvis Presley Lake,SFW,662.840.5172, ,Natchez Trace MP 264.9,16, ,WE FT DW NR 
-97.841,30.327,EMMA/Emma Long Metropolitan Park  TYPE:CP PH:512.346.1831   SITES:60  AMEN:WE DP  LON/LAT:-97.841/30.327,EMMA,Emma Long Metropolitan Park,CP,512.346.1831, , ,60, ,WE DP 
-98.814,30.501,ENCH/Enchanted Rock State Natural Area  TYPE:SP PH:325.247.3903 OPEN:all year  SITES:100 EL:1393 AMEN:NH ND VT NW NS RS  LON/LAT:-98.814/30.501,ENCH,Enchanted Rock State Natural Area,SP,325.247.3903,all year, ,100,1393,NH ND VT NW NS RS 
-93.014,30.999,ENDU/Enduro Complex  TYPE:NF PH:318.793.9427/318.471.7160 OPEN:all year  SITES:35  AMEN:NH ND VT NW NS NR N$  LON/LAT:-93.014/30.999,ENDU,Enduro Complex,NF,318.793.9427/318.471.7160,all year, ,35, ,NH ND VT NW NS NR N$ 
-88.017,36.855,ENER/Energy Lake - LBL  TYPE:NF PH:270.924.2000/270.924.2000   SITES:48  AMEN:E ND FT DW SH NR  LON/LAT:-88.017/36.855,ENER,Energy Lake - LBL,NF,270.924.2000/270.924.2000, , ,48, ,E ND FT DW SH NR 
-85.716,31.409,ENGI/Engineer Beach RV Military - Fort Rucker  TYPE:MIL PH:334.255.4234  COMM:military only - do not use our lat/lon - contact them for directions and info   AMEN:RS  LON/LAT:-85.716/31.409,ENGI,Engineer Beach RV Military - Fort Rucker,MIL,334.255.4234, ,military only - do not use our lat/lon - contact them for directions and info, , ,RS 
-100.517,31.342,EQUA/Equalization Channel  - Twin Buttes Reservoir  TYPE:CP PH:325.277.8766  COMM:unknown facilities   AMEN:NH ND NS N$  LON/LAT:-100.517/31.342,EQUA,Equalization Channel  - Twin Buttes Reservoir,CP,325.277.8766, ,unknown facilities, , ,NH ND NS N$ 
-93.189,36.054,ERBI/Erbie - Buffalo National River  TYPE:NP      AMEN:NH ND NS NR L$  LON/LAT:-93.189/36.054,ERBI,Erbie - Buffalo National River,NP, , , , , ,NH ND NS NR L$ 
-96.655,33.255,ERWI/Erwin Park - McKinney  TYPE:CP PH:972.547.2690  COMM:unknown facilities   AMEN:RS  LON/LAT:-96.655/33.255,ERWI,Erwin Park - McKinney,CP,972.547.2690, ,unknown facilities, , ,RS 
-98.725,28.114,ESCO/Escondido Ranch Military - Kingsville NAS  TYPE:MIL PH:830.373.4419  COMM:military only - do not use our lat/lon - contact them for directions and info   AMEN:RS  LON/LAT:-98.725/28.114,ESCO,Escondido Ranch Military - Kingsville NAS,MIL,830.373.4419, ,military only - do not use our lat/lon - contact them for directions and info, , ,RS 
-88.281,37.013,EURE/Eureka - Key Dam  TYPE:COE PH:270.388.9459 OPEN:early may-late aug    AMEN:WE DP SH RS PA  LON/LAT:-88.281/37.013,EURE,Eureka - Key Dam,COE,270.388.9459,early may-late aug, , , ,WE DP SH RS PA 
-92.611,31.233,EVAN/Evangeline Camp Complex  TYPE:NF PH:318.793.9427/318.471.7160 OPEN:all year  SITES:14  AMEN:NH ND VT NW NS NR N$  LON/LAT:-92.611/31.233,EVAN,Evangeline Camp Complex,NF,318.793.9427/318.471.7160,all year, ,14, ,NH ND VT NW NS NR N$ 
-84.815,32.839,FDRO/F.D. Roosevelt State Park  TYPE:SP PH:706.663.4858 OPEN:all year   EL:1270 AMEN:E DP 40ft SH RS  LON/LAT:-84.815/32.839,FDRO,F.D. Roosevelt State Park,SP,706.663.4858,all year, , ,1270,E DP 40ft SH RS 
-84.667,30.788,FACE/Faceville Landing - Lake Seminole  TYPE:COE    SITES:7  AMEN:NH ND NW NS NR  LON/LAT:-84.667/30.788,FACE,Faceville Landing - Lake Seminole,COE, , , ,7, ,NH ND NW NS NR 
-93.609,33.66,FARC/Fair City RV Park  TYPE:CP PH:870.777.6701   SITES:100  AMEN:E DP DW SH  LON/LAT:-93.609/33.66,FARC,Fair City RV Park,CP,870.777.6701, , ,100, ,E DP DW SH 
-92.295,35.571,FARB/Fairfield Bay RV Campground  TYPE:CP PH:501.884.6029     AMEN:WE DW SH  LON/LAT:-92.295/35.571,FARB,Fairfield Bay RV Campground,CP,501.884.6029, , , , ,WE DW SH 
-96.072,31.765,FAIR/Fairfield Lake State Park  TYPE:SP PH:903.389.4514 OPEN:all year  SITES:135  AMEN:WE DP 40ft DW SH RS  LON/LAT:-96.072/31.765,FAIR,Fairfield Lake State Park,SP,903.389.4514,all year, ,135, ,WE DP 40ft DW SH RS 
-88.972,30.92,FAIR/Fairley Bridge Landing  TYPE:NF PH:601.928.5291/601.965.1700   SITES:6  AMEN:NH ND NS NR  LON/LAT:-88.972/30.92,FAIR,Fairley Bridge Landing,NF,601.928.5291/601.965.1700, , ,6, ,NH ND NS NR 
-93.094,35.738,FAIR/Fairview  TYPE:NF PH:870.446.5122/479.964.7200   SITES:11 EL:2172 AMEN:NH ND NS NR  LON/LAT:-93.094/35.738,FAIR,Fairview,NF,870.446.5122/479.964.7200, , ,11,2172,NH ND NS NR 
-90.14,30.409,FAIR/Fairview Riverside State Park  TYPE:SP PH:985.845.3318 OPEN:all year    AMEN:WES DP DW SH RS PA  LON/LAT:-90.14/30.409,FAIR,Fairview Riverside State Park,SP,985.845.3318,all year, , , ,WES DP DW SH RS PA 
-99.127,26.565,FALP/Falcon County Park  TYPE:CP   COMM:Nice area next to Falcon State Park and Falcon Lake.$2 per night.You can use the dump site at the state park - not sure if there is a charge for that .Close to Roma Bluffs World Birding Center. SITES:50  AMEN:WE ND DW SH N$  LON/LAT:-99.127/26.565,FALP,Falcon County Park,CP, , ,Nice area next to Falcon State Park and Falcon Lake.$2 per night.You can use the dump site at the state park - not sure if there is a charge for that .Close to Roma Bluffs World Birding Center.,50, ,WE ND DW SH N$ 
-99.143,26.583,FALC/Falcon State Park  TYPE:SP PH:956.848.5327 OPEN:all year  SITES:122  AMEN:WE DP DW SH RS L$  LON/LAT:-99.143/26.583,FALC,Falcon State Park,SP,956.848.5327,all year, ,122, ,WE DP DW SH RS L$ 
-80.455,33.965,FALC/Falcons Nest Military - Shaw AFB  TYPE:MIL PH:803.895.0449  COMM:military only - do not use our lat/lon - contact them for directions and info   AMEN:RS  LON/LAT:-80.455/33.965,FALC,Falcons Nest Military - Shaw AFB,MIL,803.895.0449, ,military only - do not use our lat/lon - contact them for directions and info, , ,RS 
-84.826,36.951,FALL/Fall Creek   PH:606.348.6042   SITES:10  AMEN:E DP DW SH  LON/LAT:-84.826/36.951,FALL,Fall Creek, ,606.348.6042, , ,10, ,E DP DW SH 
-85.357,35.655,FALL/Fall Creek Falls State Park  TYPE:SP PH:800.250.8611 OPEN:all year COMM:for reservations phone park directly SITES:238 EL:1764 AMEN:WE DP DW SH RS  LON/LAT:-85.357/35.655,FALL,Fall Creek Falls State Park,SP,800.250.8611,all year,for reservations phone park directly,238,1764,WE DP DW SH RS 
-82.371,31.94,FALL/Falling Rocks County Park  TYPE:CP PH:912.367.7731   SITES:20  AMEN:E DP DW SH  LON/LAT:-82.371/31.94,FALL,Falling Rocks County Park,CP,912.367.7731, , ,20, ,E DP DW SH 
-85.528,30.73,FALL/Falling Waters State Park  TYPE:SP PH:850.638.6130 OPEN:all year    AMEN:E DP 45ft DW SH RS PA  LON/LAT:-85.528/30.73,FALL,Falling Waters State Park,SP,850.638.6130,all year, , , ,E DP 45ft DW SH RS PA 
-96.92,31.25,FALB/Falls on the Brazos Park  TYPE:CP    SITES:15  AMEN:WE DP  LON/LAT:-96.92/31.25,FALB,Falls on the Brazos Park,CP, , , ,15, ,WE DP 
-81.673,29.103,FARL/Farles Prairie  TYPE:NF PH:352.669.3153/850.523.8500   SITES:25  AMEN:NR  LON/LAT:-81.673/29.103,FARL,Farles Prairie,NF,352.669.3153/850.523.8500, , ,25, ,NR 
