-92.951,35.115,PETI/Petit Jean State Park  TYPE:SP PH:501.727.5441 OPEN:all year    AMEN:E DP DW SH RS  LON/LAT:-92.951/35.115,PETI,Petit Jean State Park,SP,501.727.5441,all year, , , ,E DP DW SH RS 
-76.421,35.796,PETT/Pettigrew State Park  TYPE:SP PH:252.797.4475 OPEN:all year    AMEN:NH DW SH RS  LON/LAT:-76.421/35.796,PETT,Pettigrew State Park,SP,252.797.4475,all year, , , ,NH DW SH RS 
-80.283,27.111,PHIP/Phipps County Park  TYPE:CP PH:772.287.6565     AMEN:E DW SH  LON/LAT:-80.283/27.111,PHIP,Phipps County Park,CP,772.287.6565, , , , ,E DW SH 
-88.304,33.235,PICK/Pickensville  TYPE:COE PH:205.373.6328 OPEN:all year    AMEN:WES DP DW SH RS PA  LON/LAT:-88.304/33.235,PICK,Pickensville,COE,205.373.6328,all year, , , ,WES DP DW SH RS PA 
-84.797,36.551,PICK/Pickett State Rustic Park  TYPE:SP PH:931.879.5821 OPEN:all year  SITES:32 EL:1584 AMEN:WE DP DW SH NR  LON/LAT:-84.797/36.551,PICK,Pickett State Rustic Park,SP,931.879.5821,all year, ,32,1584,WE DP DW SH NR 
-88.26,35.067,PICW/Pickwick Dam Tailwater  TYPE:TVA PH:800.882.5263 OPEN:mid mar-mid dec  SITES:95  AMEN:E DP FT DW SH NR  LON/LAT:-88.26/35.067,PICW,Pickwick Dam Tailwater,TVA,800.882.5263,mid mar-mid dec, ,95, ,E DP FT DW SH NR 
-88.24,35.055,PICL/Pickwick Landing State Park  TYPE:SP PH:901.689.3129 OPEN:all year  SITES:48  AMEN:WE DP DW SH NR  LON/LAT:-88.24/35.055,PICL,Pickwick Landing State Park,SP,901.689.3129,all year, ,48, ,WE DP DW SH NR 
-85.322,37.246,PIKE/Pikes Ridge - Green River Lake  TYPE:COE PH:270.465.6488 OPEN:mid apr-mid sep  SITES:60  AMEN:WES DP NS RS PA  LON/LAT:-85.322/37.246,PIKE,Pikes Ridge - Green River Lake,COE,270.465.6488,mid apr-mid sep, ,60, ,WES DP NS RS PA 
-93.729,34.169,PIKE/Pikeville        AMEN:NH ND NS  LON/LAT:-93.729/34.169,PIKE,Pikeville, , , , , , ,NH ND NS 
-97.07,33.103,PILO/Pilot Knoll Park - Lake Lewisville  TYPE:CP    SITES:48  AMEN:E DP DW SH  LON/LAT:-97.07/33.103,PILO,Pilot Knoll Park - Lake Lewisville,CP, , , ,48, ,E DP DW SH 
-80.466,36.344,PILO/Pilot Mountain State Park  TYPE:SP PH:336.325.2355 OPEN:mid mar-late nov   EL:1275 AMEN:NH 35ft DW SH RS  LON/LAT:-80.466/36.344,PILO,Pilot Mountain State Park,SP,336.325.2355,mid mar-late nov, , ,1275,NH 35ft DW SH RS 
-92.099,34.295,LINB/Pine Bluff Aresenal Military  TYPE:MIL PH:870.540.3778  COMM:military only - do not use our lat/lon - contact them for directions and info   AMEN:RS  LON/LAT:-92.099/34.295,LINB,Pine Bluff Aresenal Military,MIL,870.540.3778, ,military only - do not use our lat/lon - contact them for directions and info, , ,RS 
-95.091,34.113,PINC/Pine Creek Cove - Pine Creek Lake  TYPE:COE PH:580.933.4215 OPEN:early apr-late sep    AMEN:WES DP DW SH RS L$  LON/LAT:-95.091/34.113,PINC,Pine Creek Cove - Pine Creek Lake,COE,580.933.4215,early apr-late sep, , , ,WES DP DW SH RS L$ 
-85.604,33.725,PINE/Pine Glen  TYPE:NF PH:256.463.2272/334.832.4470   SITES:31  AMEN:NH ND NS NR  LON/LAT:-85.604/33.725,PINE,Pine Glen,NF,256.463.2272/334.832.4470, , ,31, ,NH ND NS NR 
-85.882,30.429,PINE/Pine Log State Forest  TYPE:SF PH:850.535.2888   SITES:20  AMEN:WE DP DW SH NR  LON/LAT:-85.882/30.429,PINE,Pine Log State Forest,SF,850.535.2888, , ,20, ,WE DP DW SH NR 
-83.702,36.742,PINM/Pine Mountain State Park  TYPE:SP     EL:1066 AMEN:NR  LON/LAT:-83.702/36.742,PINM,Pine Mountain State Park,SP, , , , ,1066,NR 
-94.4,34.103,PINR/Pine Ridge  TYPE:COE PH:870.642.6111 OPEN:early mar-late nov    AMEN:E DP DW SH RS L$  LON/LAT:-94.4/34.103,PINR,Pine Ridge,COE,870.642.6111,early mar-late nov, , , ,E DP DW SH RS L$ 
-104.827,31.896,PINS/Pine Springs - Guadalupe Mountains National Park  TYPE:NP PH:915.828.3251   SITES:20 EL:5820 AMEN:NH NR  LON/LAT:-104.827/31.896,PINS,Pine Springs - Guadalupe Mountains National Park,NP,915.828.3251, , ,20,5820,NH NR 
-88.035,36.487,PINE/Piney   PH:270.924.2000/270.924.2000   SITES:607  AMEN:E DP DW SH  LON/LAT:-88.035/36.487,PINE,Piney, ,270.924.2000/270.924.2000, , ,607, ,E DP DW SH 
-88.036,36.487,PINE/Piney  - LBL  TYPE:NF      AMEN:E DP DW SH NR  LON/LAT:-88.036/36.487,PINE,Piney  - LBL,NF, , , , , ,E DP DW SH NR 
-93.317,35.398,PINB/Piney Bay - Lake Dardanelle  TYPE:COE PH:479.885.3029 OPEN:early mar-late oct    AMEN:E DP DW SH RS  LON/LAT:-93.317/35.398,PINB,Piney Bay - Lake Dardanelle,COE,479.885.3029,early mar-late oct, , , ,E DP DW SH RS 
-88.328,34.569,PINE/Piney Grove  TYPE:COE PH:662.728.1134 OPEN:early mar-late nov COMM:Natchez Trace MP 293.5 SITES:144  AMEN:WE DP FT DW SH RS PA  LON/LAT:-88.328/34.569,PINE,Piney Grove,COE,662.728.1134,early mar-late nov,Natchez Trace MP 293.5,144, ,WE DP FT DW SH RS PA 
-87.987,34.392,PINP/Piney Point  TYPE:UTIL    SITES:48  AMEN:WE DP SH  LON/LAT:-87.987/34.392,PINP,Piney Point,UTIL, , , ,48, ,WE DP SH 
-94.168,33.299,PINP/Piney Point - Wright Patman Lake  TYPE:COE PH:903.838.8781 OPEN:early mar-late nov  SITES:70  AMEN:E DP DW SH RS  LON/LAT:-94.168/33.299,PINP,Piney Point - Wright Patman Lake,COE,903.838.8781,early mar-late nov, ,70, ,E DP DW SH RS 
-100.516,36.836,PION/Pioneer - Beaver Dunes State Park  TYPE:SP PH:580.625.3373 OPEN:all year    AMEN:E DW SH  LON/LAT:-100.516/36.836,PION,Pioneer - Beaver Dunes State Park,SP,580.625.3373,all year, , , ,E DW SH 
-100.222,34.958,PION/Pioneer County Park  TYPE:CP PH:806 447 5408   SITES:40 EL:1951 AMEN:WE DP NS L$  LON/LAT:-100.222/34.958,PION,Pioneer County Park,CP,806 447 5408, , ,40,1951,WE DP NS L$ 
-88.169,36.937,PISG/Pisgah Bay - DFWR  TYPE:SFW  OPEN:all year COMM:Fish/Wildlife sites may have few facilitiies   AMEN:NH ND VT NS NR N$  LON/LAT:-88.169/36.937,PISG,Pisgah Bay - DFWR,SFW, ,all year,Fish/Wildlife sites may have few facilitiies, , ,NH ND VT NS NR N$ 
-96.553,33.924,PLAT/Platter Flats - Lake Texoma  TYPE:COE PH:580.434.5864 OPEN:early apr-late sep    AMEN:E DP DW SH RS L$  LON/LAT:-96.553/33.924,PLAT,Platter Flats - Lake Texoma,COE,580.434.5864,early apr-late sep, , , ,E DP DW SH RS L$ 
-90.099,34.779,PLEA/Pleasant Hill - Arkabutla Lake  TYPE:COE PH:662.562.6261     AMEN:NH ND NS NR  LON/LAT:-90.099/34.779,PLEA,Pleasant Hill - Arkabutla Lake,COE,662.562.6261, , , , ,NH ND NS NR 
-82.482,35.092,PLEA/Pleasant Ridge County Park  TYPE:CP PH:864.288.6470   SITES:25 EL:1168 AMEN:E DP DW SH L$  LON/LAT:-82.482/35.092,PLEA,Pleasant Ridge County Park,CP,864.288.6470, , ,25,1168,E DP DW SH L$ 
-93.578,31.244,PLEA/Pleasure Point State Rec Area  TYPE:SRA      AMEN:E DP DW SH NR  LON/LAT:-93.578/31.244,PLEA,Pleasure Point State Rec Area,SRA, , , , , ,E DP DW SH NR 
-97.494,32.064,PLOW/Plowman Creek - Lake Whitney  TYPE:COE PH:254.694.3189 OPEN:early apr-late dec    AMEN:E DP DW SH RS  LON/LAT:-97.494/32.064,PLOW,Plowman Creek - Lake Whitney,COE,254.694.3189,early apr-late dec, , , ,E DP DW SH RS 
-101.75,35.612,PLUM/Plum Creek - Lake Meredith National Rec Area  TYPE:NP PH:806.857.3151    EL:2937 AMEN:NH ND VT NW NS NR  LON/LAT:-101.75/35.612,PLUM,Plum Creek - Lake Meredith National Rec Area,NP,806.857.3151, , , ,2937,NH ND VT NW NS NR 
-89.854,34.162,PLUM/Plum Point        AMEN:NH ND NS  LON/LAT:-89.854/34.162,PLUM,Plum Point, , , , , , ,NH ND NS 
-90.971,36.254,POCA/Pocahontas City Park  TYPE:CP PH:870.892.8896     AMEN:E DP  LON/LAT:-90.971/36.254,POCA,Pocahontas City Park,CP,870.892.8896, , , , ,E DP 
-85.083,34.586,POCK/Pocket  TYPE:NF PH:706.638.1085/770.297.3000   SITES:56  AMEN:NH NR  LON/LAT:-85.083/34.586,POCK,Pocket,NF,706.638.1085/770.297.3000, , ,56, ,NH NR 
-80.534,33.801,POIN/Poinsett State Park  TYPE:SP PH:803.494.8177 OPEN:all year  SITES:50  AMEN:E DP DW SH RS PA  LON/LAT:-80.534/33.801,POIN,Poinsett State Park,SP,803.494.8177,all year, ,50, ,E DP DW SH RS PA 
-93.29,34.282,POIN/Point Cedar - De Gray Lake  TYPE:COE PH:870.246.5501   SITES:62  AMEN:NH ND FT NS NR  LON/LAT:-93.29/34.282,POIN,Point Cedar - De Gray Lake,COE,870.246.5501, , ,62, ,NH ND FT NS NR 
-86.938,34.574,POIN/Point Mallard City Campground  TYPE:CP      AMEN:E DP DW SH  LON/LAT:-86.938/34.574,POIN,Point Mallard City Campground,CP, , , , , ,E DP DW SH 
-92.565,36.39,POIN/Point Return City Park  TYPE:CP PH:870.445.4775   SITES:22  AMEN:DP FT DW L$  LON/LAT:-92.565/36.39,POIN,Point Return City Park,CP,870.445.4775, , ,22, ,DP FT DW L$ 
-82.315,33.689,POIN/Pointes West Military - Fort Gordon  TYPE:MIL PH:706.541.1057  COMM:military only - do not use our lat/lon - contact them for directions and info   AMEN:RS  LON/LAT:-82.315/33.689,POIN,Pointes West Military - Fort Gordon,MIL,706.541.1057, ,military only - do not use our lat/lon - contact them for directions and info, , ,RS 
-84.099,35.827,POLA/Poland Creek        LON/LAT:-84.099/35.827,POLA,Poland Creek, , , , , , ,
-86.512,36.053,POOL/Poole Knobs  TYPE:TVA PH:615.459.6948     AMEN:E DP 45ft DW SH RS L$  LON/LAT:-86.512/36.053,POOL,Poole Knobs,TVA,615.459.6948, , , , ,E DP 45ft DW SH RS L$ 
-79.016,35.724,POPL/Poplar Point State Rec Area - Jordan Lake  TYPE:SRA PH:919.362.0586 OPEN:mid mar-late nov    AMEN:WE DP RS  LON/LAT:-79.016/35.724,POPL,Poplar Point State Rec Area - Jordan Lake,SRA,919.362.0586,mid mar-late nov, , , ,WE DP RS 
-82.909,36.963,PO31/Portal 31 RV Park  TYPE:CP PH:606.848.1530   SITES:20 EL:1795 AMEN:WE DP  LON/LAT:-82.909/36.963,PO31,Portal 31 RV Park,CP,606.848.1530, , ,20,1795,WE DP 
-95.391,35.358,PORU/Porum Landing - Eufaula Lake  TYPE:COE PH:918.799.5843 OPEN:early apr-late sep    AMEN:E DP DW SH RS L$  LON/LAT:-95.391/35.358,PORU,Porum Landing - Eufaula Lake,COE,918.799.5843,early apr-late sep, , , ,E DP DW SH RS L$ 
-85.078,35.311,POSS/Possum Creek  TYPE:TVA PH:423.332.1863     AMEN:NR  LON/LAT:-85.078/35.311,POSS,Possum Creek,TVA,423.332.1863, , , , ,NR 
-98.559,32.874,POSS/Possum Kingdom State Park  TYPE:SP PH:940.549.1803 OPEN:all year  SITES:16 EL:1070 AMEN:E DP DW SH RS  LON/LAT:-98.559/32.874,POSS,Possum Kingdom State Park,SP,940.549.1803,all year, ,16,1070,E DP DW SH RS 
-95.963,36.909,POST/Post Oak Park - Copan Lake  TYPE:COE PH:918.532.4334 OPEN:early apr-late oct    AMEN:WES DP DW SH RS  LON/LAT:-95.963/36.909,POST,Post Oak Park - Copan Lake,COE,918.532.4334,early apr-late oct, , , ,WES DP DW SH RS 
-95.323,34.671,POTA/Potato Hills Central  TYPE:COE PH:918.569.4131 OPEN:early apr-late oct    AMEN:E DP SH RS  LON/LAT:-95.323/34.671,POTA,Potato Hills Central,COE,918.569.4131,early apr-late oct, , , ,E DP SH RS 
-84.098,34.948,POTE/Poteete Creek  TYPE:CP PH:706.439.6103    EL:1830 AMEN:E DP DW SH  LON/LAT:-84.098/34.948,POTE,Poteete Creek,CP,706.439.6103, , , ,1830,E DP DW SH 
-98.263,29.908,POTT/Potters Creek - Canyon Lake  TYPE:COE PH:830.964.3341 OPEN:all year  SITES:120  AMEN:WES DP 45ft DW SH RS PA  LON/LAT:-98.263/29.908,POTT,Potters Creek - Canyon Lake,COE,830.964.3341,all year, ,120, ,WES DP 45ft DW SH RS PA 
-96.724,35.522,PRAG/Prague City Lake  TYPE:CP PH:405.567.2805     AMEN:E DP FT DW SH  LON/LAT:-96.724/35.522,PRAG,Prague City Lake,CP,405.567.2805, , , , ,E DP FT DW SH 
-86.77,32.338,PRAI/Prairie Creek  TYPE:COE PH:334.418.4919 OPEN:all year  SITES:40  AMEN:WE DP DW SH RS L$  LON/LAT:-86.77/32.338,PRAI,Prairie Creek,COE,334.418.4919,all year, ,40, ,WE DP DW SH RS L$ 
-94.053,36.355,PRAI/Prairie Creek - Beaver Lake  TYPE:COE PH:479.925.3957 OPEN:all year  SITES:112 EL:1139 AMEN:WES DP FT DW SH RS PA  LON/LAT:-94.053/36.355,PRAI,Prairie Creek - Beaver Lake,COE,479.925.3957,all year, ,112,1139,WES DP FT DW SH RS PA 
-99.463,32.037,PRES/Press Morris Park  TYPE:CP    SITES:18 EL:1739 AMEN:WES DP PT SH  LON/LAT:-99.463/32.037,PRES,Press Morris Park,CP, , , ,18,1739,WES DP PT SH 
-96.649,33.884,PRES/Preston Bend - Lake Texoma  TYPE:COE PH:903.786.8408 OPEN:early apr-late sep  SITES:40  AMEN:WE DP DW SH RS  LON/LAT:-96.649/33.884,PRES,Preston Bend - Lake Texoma,COE,903.786.8408,early apr-late sep, ,40, ,WE DP DW SH RS 
-96.649,33.884,PRES/Preston Bend - Lake Texoma  TYPE:COE PH:903.465.4990     AMEN:E DP NR  LON/LAT:-96.649/33.884,PRES,Preston Bend - Lake Texoma,COE,903.465.4990, , , , ,E DP NR 
-79.003,34.39,PRIN/Princess Ann - Lumber River State Park  TYPE:SP PH:910.628.4564 OPEN:all year  SITES:8  AMEN:NH DW RS  LON/LAT:-79.003/34.39,PRIN,Princess Ann - Lumber River State Park,SP,910.628.4564,all year, ,8, ,NH DW RS 
-81.24,29.654,PRIN/Princess Place Preserve  TYPE:CP PH:386.313.4020  COMM:tents only   AMEN:NH ND NS  LON/LAT:-81.24/29.654,PRIN,Princess Place Preserve,CP,386.313.4020, ,tents only, , ,NH ND NS 
-98.491,31.982,PROM/Promontory - Proctor Lake  TYPE:COE PH:254.893.7545 OPEN:early apr-late sep  SITES:85 EL:1221 AMEN:WE DP DW SH RS  LON/LAT:-98.491/31.982,PROM,Promontory - Proctor Lake,COE,254.893.7545,early apr-late sep, ,85,1221,WE DP DW SH RS 
-96.39,31.425,PUB2/Public Use Area 2 - Groesbeck  TYPE:CP PH:254.729.3810  COMM:primitive   AMEN:NH ND NW NS  LON/LAT:-96.39/31.425,PUB2,Public Use Area 2 - Groesbeck,CP,254.729.3810, ,primitive, , ,NH ND NW NS 
-96.378,31.448,PUB3/Public Use Area 3 - Groesbeck  TYPE:CP PH:254.729.3810  COMM:primitive   AMEN:NH ND NW NS  LON/LAT:-96.378/31.448,PUB3,Public Use Area 3 - Groesbeck,CP,254.729.3810, ,primitive, , ,NH ND NW NS 
-96.308,31.331,PUB5/Public Use Area 5 - Thornton  TYPE:CP PH:254.729.3810  COMM:primitive   AMEN:NH ND NW NS  LON/LAT:-96.308/31.331,PUB5,Public Use Area 5 - Thornton,CP,254.729.3810, ,primitive, , ,NH ND NW NS 
-95.994,32.354,PURT/Purtis Creek State Park  TYPE:SP PH:903.425.2332 OPEN:all year  SITES:78  AMEN:WE DP DW SH RS  LON/LAT:-95.994/32.354,PURT,Purtis Creek State Park,SP,903.425.2332,all year, ,78, ,WE DP DW SH RS 
-89.348,34.438,PUSK/Puskus Lake  TYPE:NF PH:601.236.6550/601.965.1700   SITES:66  AMEN:NH NR  LON/LAT:-89.348/34.438,PUSK,Puskus Lake,NF,601.236.6550/601.965.1700, , ,66, ,NH NR 
-85.156,33.024,PYNE/Pyne Road Park  TYPE:CP PH:706.884.1414   SITES:24  AMEN:E DP  LON/LAT:-85.156/33.024,PYNE,Pyne Road Park,CP,706.884.1414, , ,24, ,E DP 
-93.165,34.957,QUAC/Quarry Cove  TYPE:COE PH:501.272.4233     AMEN:E DP DW SH NR  LON/LAT:-93.165/34.957,QUAC,Quarry Cove,COE,501.272.4233, , , , ,E DP DW SH NR 
-92.242,36.255,QUAR/Quarry Cove - Norfolk Lake  TYPE:COE PH:479.272.4233 OPEN:all year    AMEN:E DP DW SH RS PA  LON/LAT:-92.242/36.255,QUAR,Quarry Cove - Norfolk Lake,COE,479.272.4233,all year, , , ,E DP DW SH RS PA 
-94.723,34.944,QURI/Quarry Island - Lake Wister State Park  TYPE:SP PH:918.655.7212 OPEN:all year    AMEN:DP DW SH  LON/LAT:-94.723/34.944,QURI,Quarry Island - Lake Wister State Park,SP,918.655.7212,all year, , , ,DP DW SH 
-94.372,34.686,QUEE/Queen Wilhelmina State Park  TYPE:SP PH:479.394.2863 OPEN:all year   EL:2488 AMEN:E RS  LON/LAT:-94.372/34.686,QUEE,Queen Wilhelmina State Park,SP,479.394.2863,all year, , ,2488,E RS 
-80.153,26.306,QUIE/Quiet Waters Park  TYPE:CP PH:954.360.1315  COMM:rent a tent only   AMEN:E  LON/LAT:-80.153/26.306,QUIE,Quiet Waters Park,CP,954.360.1315, ,rent a tent only, , ,E 
-84.548,35.229,QUIN/Quinn Springs Rec Area  TYPE:NF PH:423.338.3300/423.476.9700   SITES:44  AMEN:NH DW SH NR  LON/LAT:-84.548/35.229,QUIN,Quinn Springs Rec Area,NF,423.338.3300/423.476.9700, , ,44, ,NH DW SH NR 
-95.304,28.933,QUIN/Quintana Beach City Park  TYPE:CP PH:979.233.1461   SITES:56  AMEN:WES DP DW SH  LON/LAT:-95.304/28.933,QUIN,Quintana Beach City Park,CP,979.233.1461, , ,56, ,WES DP DW SH 
-85.156,32.922,RSHA/R Shaefer Heard  TYPE:COE PH:706.645.2404 OPEN:early mar-mid oct    AMEN:WE DP 65ft DW SH RS PA  LON/LAT:-85.156/32.922,RSHA,R Shaefer Heard,COE,706.645.2404,early mar-mid oct, , , ,WE DP 65ft DW SH RS PA 
-97.055,34.759,RCLO/R.C. Longmire Lake  TYPE:CP      AMEN:E DP FT DW SH  LON/LAT:-97.055/34.759,RCLO,R.C. Longmire Lake,CP, , , , , ,E DP FT DW SH 
-83.474,34.754,RABU/Rabun Beach  TYPE:NF PH:706.782.332/770.297.3000   SITES:82 EL:1832 AMEN:E DP DW SH NR  LON/LAT:-83.474/34.754,RABU,Rabun Beach,NF,706.782.332/770.297.3000, , ,82,1832,E DP DW SH NR 
-82.487,27.827,RACC/Raccoon Creek Military - MacDill AFB  TYPE:MIL PH:813.840.6919  COMM:military only - do not use our lat/lon - contact them for directions and info   AMEN:RS  LON/LAT:-82.487/27.827,RACC,Raccoon Creek Military - MacDill AFB,MIL,813.840.6919, ,military only - do not use our lat/lon - contact them for directions and info, , ,RS 
-85.703,35.975,RAGL/Ragland Bottom  TYPE:COE PH:931.761.3616 OPEN:mid apr-late sep    AMEN:WES DP DW SH RS PA  LON/LAT:-85.703/35.975,RAGL,Ragland Bottom,COE,931.761.3616,mid apr-late sep, , , ,WES DP DW SH RS PA 
-93.825,31.682,RAGT/Ragtown  TYPE:NF PH:409.787.3870/936.639.8501   SITES:25  AMEN:NH DP DW SH NR L$  LON/LAT:-93.825/31.682,RAGT,Ragtown,NF,409.787.3870/936.639.8501, , ,25, ,NH DP DW SH NR L$ 
-82.422,29.088,RAIN/Rainbow Springs State Park  TYPE:SP PH:352.465.8550 OPEN:all year    AMEN:WES DP DW SH RS PA  LON/LAT:-82.422/29.088,RAIN,Rainbow Springs State Park,SP,352.465.8550,all year, , , ,WES DP DW SH RS PA 
-83.154,35.192,RALP/Ralph Andrews County Park  TYPE:CP  OPEN:mid apr-late oct  SITES:47  AMEN:WES DP FT DW SH  LON/LAT:-83.154/35.192,RALP,Ralph Andrews County Park,CP, ,mid apr-late oct, ,47, ,WES DP FT DW SH 
-88.797,37.138,RAMP/Ramp - West Kentucky WMA  TYPE:SFW  OPEN:all year COMM:Fish/Wildlife sites may have few facilitiies   AMEN:NH ND VT NS NR N$  LON/LAT:-88.797/37.138,RAMP,Ramp - West Kentucky WMA,SFW, ,all year,Fish/Wildlife sites may have few facilitiies, , ,NH ND VT NS NR N$ 
-98.261,35.073,RAND/Randlett Park  TYPE:CP PH:405.247.6484     AMEN:E DP L$  LON/LAT:-98.261/35.073,RAND,Randlett Park,CP,405.247.6484, , , , ,E DP L$ 
-92.503,31.296,RAPI/Rapides Coliseum  TYPE:CP PH:318.442.9581     AMEN:E DP NS  LON/LAT:-92.503/31.296,RAPI,Rapides Coliseum,CP,318.442.9581, , , , ,E DP NS 
-85.613,30.095,RAPT/Raptor Ranch - Tyndall AFB Military  TYPE:MIL PH:850.283.2798  COMM:military only - do not use our lat/lon - contact them for directions and info   AMEN:E DP FT DW SH RS  LON/LAT:-85.613/30.095,RAPT,Raptor Ranch - Tyndall AFB Military,MIL,850.283.2798, ,military only - do not use our lat/lon - contact them for directions and info, , ,E DP FT DW SH RS 
-95.15,31.391,RATC/Ratcliff Lake  TYPE:NF PH:936.655.2299/936.639.8501 OPEN:all year  SITES:72  AMEN:WES DP DW SH RS  LON/LAT:-95.15/31.391,RATC,Ratcliff Lake,NF,936.655.2299/936.639.8501,all year, ,72, ,WES DP DW SH RS 
-95.483,34.197,RATT/Rattan Landing -  Hugo Lake  TYPE:COE PH:580.326.3345     AMEN:E ND NS NR L$  LON/LAT:-95.483/34.197,RATT,Rattan Landing -  Hugo Lake,COE,580.326.3345, , , , ,E ND NS NR L$ 
-94.088,31.133,RAYB/Rayburn - Sam Rayburn Reservoir  TYPE:COE PH:409.384.5716 OPEN:all year  SITES:70  AMEN:E DP DW SH RS PA L$  LON/LAT:-94.088/31.133,RAYB,Rayburn - Sam Rayburn Reservoir,COE,409.384.5716,all year, ,70, ,E DP DW SH RS PA L$ 
-95.256,33.994,RAYM/Raymond Gary State Park  TYPE:SP PH:580.873.2307 OPEN:all year    AMEN:E DW SH  LON/LAT:-95.256/33.994,RAYM,Raymond Gary State Park,SP,580.873.2307,all year, , , ,E DW SH 
-92.274,30.25,RAYN/Rayne RV Park Gossen Memorial Park  TYPE:CP    SITES:737  AMEN:WES DP FT DW SH PA  LON/LAT:-92.274/30.25,RAYN,Rayne RV Park Gossen Memorial Park,CP, , , ,737, ,WES DP FT DW SH PA 
-82.476,33.629,RAYS/Raysville - Strom Thurmond Lake  TYPE:COE PH:706.595.6759 OPEN:early mar-late sep    AMEN:E DP DW SH RS  LON/LAT:-82.476/33.629,RAYS,Raysville - Strom Thurmond Lake,COE,706.595.6759,early mar-late sep, , , ,E DP DW SH RS 
-101.456,31.202,REAG/Reagan County Park  TYPE:CP   COMM:primitive SITES:81 EL:2680 AMEN:WE DP FT  LON/LAT:-101.456/31.202,REAG,Reagan County Park,CP, , ,primitive,81,2680,WE DP FT 
-100.933,35.534,RECR/Recreation RV Park - Pampa  TYPE:CP PH:806.669.5790   SITES:25 EL:3213 AMEN:WE DP DW SH  LON/LAT:-100.933/35.534,RECR,Recreation RV Park - Pampa,CP,806.669.5790, , ,25,3213,WE DP DW SH 
-90.285,36.257,RECT/Rector City Park  TYPE:CP  OPEN:all year    AMEN:WES DP L$  LON/LAT:-90.285/36.257,RECT,Rector City Park,CP, ,all year, , , ,WES DP L$ 
-93.144,31.498,REDB/Red Bluff Camp Complex  TYPE:NF PH:318.472.1840/318.471.7160   SITES:10  AMEN:NH ND VT NW NS NR  LON/LAT:-93.144/31.498,REDB,Red Bluff Camp Complex,NF,318.472.1840/318.471.7160, , ,10, ,NH ND VT NW NS NR 
-93.833,31.474,REDH/Red Hills Lake  TYPE:NF PH:409.787.3870/936.639.8501   SITES:26  AMEN:E DP VT DW SH NR L$  LON/LAT:-93.833/31.474,REDH,Red Hills Lake,NF,409.787.3870/936.639.8501, , ,26, ,E DP VT DW SH NR L$ 
-96.074,35.61,REDO/Red Oak - Dripping Springs  State Park  TYPE:SP PH:918.756.5971 OPEN:all year    LON/LAT:-96.074/35.61,REDO,Red Oak - Dripping Springs  State Park,SP,918.756.5971,all year, , , ,
-98.359,35.456,REDR/Red Rock Canyon State Park  TYPE:SP PH:405.542.6344 OPEN:all year    AMEN:40ft DW SH  LON/LAT:-98.359/35.456,REDR,Red Rock Canyon State Park,SP,405.542.6344,all year, , , ,40ft DW SH 
-84.713,34.148,REDT/Red Top Mountain State Park  TYPE:SP PH:770.975.4226 OPEN:all year    AMEN:RS  LON/LAT:-84.713/34.148,REDT,Red Top Mountain State Park,SP,770.975.4226,all year, , , ,RS 
-95.662,36.419,REDB/Redbud Bay - Oologah Lake  TYPE:COE      AMEN:NH ND NS NR  LON/LAT:-95.662/36.419,REDB,Redbud Bay - Oologah Lake,COE, , , , , ,NH ND NS NR 
-88.074,36.713,REDD/Redd Hollow - LBL  TYPE:NF PH:270.924.2000/270.924.2000   SITES:39  AMEN:NH ND VT NW NS NR  LON/LAT:-88.074/36.713,REDD,Redd Hollow - LBL,NF,270.924.2000/270.924.2000, , ,39, ,NH ND VT NW NS NR 
-93.786,35.682,REDD/Redding  TYPE:NF PH:479.754.2864/479.964.7200   SITES:25  AMEN:NH ND DW SH NR L$  LON/LAT:-93.786/35.682,REDD,Redding,NF,479.754.2864/479.964.7200, , ,25, ,NH ND DW SH NR L$ 
-86.64,34.693,REDS/Redstone Arsenal RV Military  TYPE:MIL PH:256.876.4868  COMM:military only - do not use our lat/lon - contact them for directions and info   AMEN:E DP FT DW SH RS  LON/LAT:-86.64/34.693,REDS,Redstone Arsenal RV Military,MIL,256.876.4868, ,military only - do not use our lat/lon - contact them for directions and info, , ,E DP FT DW SH RS 
-83.54,31.161,REED/Reed Bingham State Park  TYPE:SP PH:229.896.3551 OPEN:all year    AMEN:E DP 50ft DW SH RS  LON/LAT:-83.54/31.161,REED,Reed Bingham State Park,SP,229.896.3551,all year, , , ,E DP 50ft DW SH RS 
-89.413,36.354,REEL/Reelfoot Lake State Park  TYPE:SP PH:800.250.8617 OPEN:all year  SITES:86  AMEN:E DP DW SH NR  LON/LAT:-89.413/36.354,REEL,Reelfoot Lake State Park,SP,800.250.8617,all year, ,86, ,E DP DW SH NR 
-97.279,28.296,REFU/Refugio City Park  TYPE:CP   COMM:beautiful - shaded SITES:15  AMEN:WES DP FT DW  LON/LAT:-97.279/28.296,REFU,Refugio City Park,CP, , ,beautiful - shaded,15, ,WES DP FT DW 
-84.331,37.385,RENF/Renfro Valley Boat Dock  TYPE:CP   COMM:swm SITES:72  AMEN:WE DP DW SH  LON/LAT:-84.331/37.385,RENF,Renfro Valley Boat Dock,CP, , ,swm,72, ,WE DP DW SH 
-97.235,31.563,REYN/Reynolds Creek - Lake Waco  TYPE:COE PH:254.756.5359 OPEN:all year  SITES:5  AMEN:WE DP DW SH RS L$  LON/LAT:-97.235/31.563,REYN,Reynolds Creek - Lake Waco,COE,254.756.5359,all year, ,5, ,WE DP DW SH RS L$ 
-82.767,34.181,RICH/Richard B. Russell State Park  TYPE:SP PH:706.213.2045 OPEN:all year    AMEN:E DW SH RS  LON/LAT:-82.767/34.181,RICH,Richard B. Russell State Park,SP,706.213.2045,all year, , , ,E DW SH RS 
-99.35,31.134,RICP/Richards City Park  TYPE:CP PH:325.597.2152   SITES:65 EL:1683 AMEN:WE DW SH L$  LON/LAT:-99.35/31.134,RICP,Richards City Park,CP,325.597.2152, , ,65,1683,WE DW SH L$ 
-98.157,33.206,RICH/Richardson State Park  TYPE:SP PH:940.567.3506 OPEN:all year   EL:1076 AMEN:E DP SH RS  LON/LAT:-98.157/33.206,RICH,Richardson State Park,SP,940.567.3506,all year, , ,1076,E DP SH RS 
-92.934,35.797,RICH/Richland Creek  TYPE:NF PH:870.446.5122/479.964.7200   SITES:13 EL:1048 AMEN:NH ND NS NR  LON/LAT:-92.934/35.797,RICH,Richland Creek,NF,870.446.5122/479.964.7200, , ,13,1048,NH ND NS NR 
-86.865,33.876,RICK/Rickwood Caverns State Park  TYPE:SP PH:205.647.9692 OPEN:all year  SITES:13  AMEN:NH DP DW SH RS  LON/LAT:-86.865/33.876,RICK,Rickwood Caverns State Park,SP,205.647.9692,all year, ,13, ,NH DP DW SH RS 
-82.264,33.677,RIDG/Ridge Road - Strom Thurmond Lake  TYPE:COE  OPEN:early apr-late sep    AMEN:WE DP DW SH RS  LON/LAT:-82.264/33.677,RIDG,Ridge Road - Strom Thurmond Lake,COE, ,early apr-late sep, , , ,WE DP DW SH RS 
-84.6,34.65,RIDW/Ridgeway     COMM:walk to sites only  EL:1259 AMEN:NH ND NS L$  LON/LAT:-84.6/34.65,RIDW,Ridgeway, , , ,walk to sites only, ,1259,NH ND NS L$ 
-84.526,35.828,RILE/Riley Creek  TYPE:TVA PH:865.376.2299     AMEN:NR  LON/LAT:-84.526/35.828,RILE,Riley Creek,TVA,865.376.2299, , , , ,NR 
-98.831,32.426,RING/Ringling Lake City Park  TYPE:CP PH:254.629.2294  COMM:unknown facilities   AMEN:NH ND NS  LON/LAT:-98.831/32.426,RING,Ringling Lake City Park,CP,254.629.2294, ,unknown facilities, , ,NH ND NS 
-102.956,29.181,RIOG/Rio Grande Village - Big Bend National Park  TYPE:NP PH:432.477.1121 OPEN:all year COMM:2 campgrounds - RV one has hookups SITES:100 EL:1834 AMEN:NH RS  LON/LAT:-102.956/29.181,RIOG,Rio Grande Village - Big Bend National Park,NP,432.477.1121,all year,2 campgrounds - RV one has hookups,100,1834,NH RS 
-91.737,34.165,RISI/Rising Star  TYPE:COE PH:870.534.0451 OPEN:early mar-late oct    AMEN:E DP 90ft DW SH RS  LON/LAT:-91.737/34.165,RISI,Rising Star,COE,870.534.0451,early mar-late oct, , , ,E DP 90ft DW SH RS 
-102.496,36.035,RITA/Rita Blanca Lake Park  TYPE:CP    SITES:24 EL:3948 AMEN:WES DP L$  LON/LAT:-102.496/36.035,RITA,Rita Blanca Lake Park,CP, , , ,24,3948,WES DP L$ 
-93.625,34.64,RIVB/River Bluff  TYPE:NF PH:870.356.4186/501.321.5202   SITES:5  AMEN:NH ND VT NW NS NR N$  LON/LAT:-93.625/34.64,RIVB,River Bluff,NF,870.356.4186/501.321.5202, , ,5, ,NH ND VT NW NS NR N$ 
-83.904,34.288,RIVF/River Forks County Park  TYPE:CP PH:770.531.3952   SITES:73 EL:1114 AMEN:WE DP DW SH  LON/LAT:-83.904/34.288,RIVF,River Forks County Park,CP,770.531.3952, , ,73,1114,WE DP DW SH 
-82.201,28.573,RIVE/River Jct - Withlacoochee State Forest  TYPE:SF PH:352.754.6896   SITES:20  AMEN:NH FT DW SH NR L$  LON/LAT:-82.201/28.573,RIVE,River Jct - Withlacoochee State Forest,SF,352.754.6896, , ,20, ,NH FT DW SH NR L$ 
