-81.023,27.539,KISS/Kissimmee Prairie State Park  TYPE:SP PH:863.462.5360 OPEN:all year    AMEN:E RS PA  LON/LAT:-81.023/27.539,KISS,Kissimmee Prairie State Park,SP,863.462.5360,all year, , , ,E RS PA 
-93.863,35.016,KNOP/Knoppers Ford  TYPE:NF PH:479.637.4174/501.321.5202 OPEN:all year  SITES:6  AMEN:NH ND VT NW NS NR L$  LON/LAT:-93.863/35.016,KNOP,Knoppers Ford,NF,479.637.4174/501.321.5202,all year, ,6, ,NH ND VT NW NS NR L$ 
-84.948,31.468,KOLO/Kolomoki Mounds State Park  TYPE:SP PH:229.724.2150 OPEN:all year    AMEN:E DP DW SH RS  LON/LAT:-84.948/31.468,KOLO,Kolomoki Mounds State Park,SP,229.724.2150,all year, , , ,E DP DW SH RS 
-83.633,37.784,KOOM/Koomer Ridge Rec Area  TYPE:NF PH:606.784.6428/859.745.3100   SITES:76 EL:1248 AMEN:NH DW SH NR  LON/LAT:-83.633/37.784,KOOM,Koomer Ridge Rec Area,NF,606.784.6428/859.745.3100, , ,76,1248,NH DW SH NR 
-81.815,26.431,KORE/Koreshan Historic State Park  TYPE:SP PH:239.992.0311 OPEN:all year    AMEN:E DP 40ft DW SH RS PA  LON/LAT:-81.815/26.431,KORE,Koreshan Historic State Park,SP,239.992.0311,all year, , , ,E DP 40ft DW SH RS PA 
-97.631,27.894,LABO/Labonte Park  TYPE:CP   COMM:get permit at city hall - 1201 Leopard SITES:20  AMEN:NH ND NS RS  LON/LAT:-97.631/27.894,LABO,Labonte Park,CP, , ,get permit at city hall - 1201 Leopard,20, ,NH ND NS RS 
-98.614,29.399,LACK/Lackland AFB Military  TYPE:MIL PH:210.671.5179  COMM:military only - do not use our lat/lon - contact them for directions and info   AMEN:RS  LON/LAT:-98.614/29.399,LACK,Lackland AFB Military,MIL,210.671.5179, ,military only - do not use our lat/lon - contact them for directions and info, , ,RS 
-98.911,30.242,LADB/Lady Bird Johnson City Park  TYPE:CP PH:830.997.4202   SITES:113 EL:1669 AMEN:WES DP DW SH  LON/LAT:-98.911/30.242,LADB,Lady Bird Johnson City Park,CP,830.997.4202, , ,113,1669,WES DP DW SH 
-84.716,34.098,LAKA/Lake Allatoona Military - Fort McPherson  TYPE:MIL   COMM:military only - do not use our lat/lon - contact them for directions and info   AMEN:RS  LON/LAT:-84.716/34.098,LAKA,Lake Allatoona Military - Fort McPherson,MIL, , ,military only - do not use our lat/lon - contact them for directions and info, , ,RS 
-81.418,27.721,LAKE/Lake Arbuckle Co Park  TYPE:CP PH:941.534.4340 OPEN:all year  SITES:30  AMEN:E ND DW SH L$  LON/LAT:-81.418/27.721,LAKE,Lake Arbuckle Co Park,CP,941.534.4340,all year, ,30, ,E ND DW SH L$ 
-98.395,33.758,LAKA/Lake Arrowhead State Park  TYPE:SP PH:940.528.2211 OPEN:all year  SITES:71  AMEN:WE DP DW SH RS  LON/LAT:-98.395/33.758,LAKA,Lake Arrowhead State Park,SP,940.528.2211,all year, ,71, ,WE DP DW SH RS 
-87.915,36.848,LAKB/Lake Barkley State Park  TYPE:SP PH:800.325.1708 OPEN:early apr-late oct  SITES:80  AMEN:E DP DW SH RS PA  LON/LAT:-87.915/36.848,LAKB,Lake Barkley State Park,SP,800.325.1708,early apr-late oct, ,80, ,E DP DW SH RS PA 
-93.376,32.443,LAKB/Lake Bistineau State Park  TYPE:SP PH:318.745.3503 OPEN:all year    AMEN:E DP DW SH RS PA  LON/LAT:-93.376/32.443,LAKB,Lake Bistineau State Park,SP,318.745.3503,all year, , , ,E DP DW SH RS PA 
-95.099,33.054,LAKS/Lake Bob Sandlin State Park  TYPE:SP PH:903.572.5531 OPEN:all year  SITES:95  AMEN:E DP DW SH RS  LON/LAT:-95.099/33.054,LAKS,Lake Bob Sandlin State Park,SP,903.572.5531,all year, ,95, ,E DP DW SH RS 
-89.025,31.712,LKBO/Lake Boque Homa  TYPE:SP PH:601.425.2148     AMEN:WE NR  LON/LAT:-89.025/31.712,LKBO,Lake Boque Homa,SP,601.425.2148, , , , ,WE NR 
-99.029,31.857,LAKB/Lake Brownwood State Park  TYPE:SP PH:325.784.5223 OPEN:all year  SITES:99 EL:1513 AMEN:WE DP DW SH RS  LON/LAT:-99.029/31.857,LAKB,Lake Brownwood State Park,SP,325.784.5223,all year, ,99,1513,WE DP DW SH RS 
-91.2,31.961,LAKR/Lake Bruin State Park  TYPE:SP PH:318.766.3530 OPEN:all year    AMEN:E DP DW SH RS PA  LON/LAT:-91.2/31.961,LAKR,Lake Bruin State Park,SP,318.766.3530,all year, , , ,E DP DW SH RS PA 
-97.21,36.125,LAKC/Lake Carl Blackwell   PH:405.744.8504  COMM:multiple campgrounds   AMEN:E DP 40ft SH  LON/LAT:-97.21/36.125,LAKC,Lake Carl Blackwell, ,405.744.8504, ,multiple campgrounds, , ,E DP 40ft SH 
-99.451,27.539,LAKC/Lake Casa Blanca State Park  TYPE:SP PH:956.725.3826 OPEN:all year  SITES:66  AMEN:E DP DW SH RS  LON/LAT:-99.451/27.539,LAKC,Lake Casa Blanca State Park,SP,956.725.3826,all year, ,66, ,E DP DW SH RS 
-92.919,34.437,LKCS/Lake Catherine State Park  TYPE:SP PH:501.844.4176 OPEN:all year    AMEN:E DP 60ft DW SH RS  LON/LAT:-92.919/34.437,LKCS,Lake Catherine State Park,SP,501.844.4176,all year, , , ,E DP 60ft DW SH RS 
-91.153,36.068,LKCP/Lake Charles State Park  TYPE:SP PH:870.878.6595 OPEN:all year    AMEN:E DP DW SH RS  LON/LAT:-91.153/36.068,LKCP,Lake Charles State Park,SP,870.878.6595,all year, , , ,E DP DW SH RS 
-90.957,33.865,LKCH/Lake Charlie Capps  TYPE:SP PH:662.759.6444     AMEN:E DP NR  LON/LAT:-90.957/33.865,LKCH,Lake Charlie Capps,SP,662.759.6444, , , , ,E DP NR 
-83.78,34.955,LACH/Lake Chatuga  TYPE:TVA PH:706.745.6928 OPEN:all year  SITES:10 EL:1945 AMEN:NH N$  LON/LAT:-83.78/34.955,LACH,Lake Chatuga,TVA,706.745.6928,all year, ,10,1945,NH N$ 
-98.129,35.147,LACH/Lake Chickasha  TYPE:CP PH:405 453 7915   SITES:50  AMEN:E DP DW SH L$  LON/LAT:-98.129/35.147,LACH,Lake Chickasha,CP,405 453 7915, , ,50, ,E DP DW SH L$ 
-91.197,33.37,LKCH/Lake Chicot State Park  TYPE:SP PH:870.265.5480 OPEN:all year    AMEN:E DP DW SH RS  LON/LAT:-91.197/33.37,LKCH,Lake Chicot State Park,SP,870.265.5480,all year, , , ,E DP DW SH RS 
-85.874,33.461,LAKC/Lake Chinnabee  TYPE:NF PH:256.362.2909/334.832.4470 OPEN:all year  SITES:10  AMEN:NH ND NS NR L$  LON/LAT:-85.874/33.461,LAKC,Lake Chinnabee,NF,256.362.2909/334.832.4470,all year, ,10, ,NH ND NS NR L$ 
-92.923,32.713,LAKC/Lake Claiborne State Park  TYPE:SP PH:318.927.2976 OPEN:all year    AMEN:E DP 40ft DW SH RS PA  LON/LAT:-92.923/32.713,LAKC,Lake Claiborne State Park,SP,318.927.2976,all year, , , ,E DP 40ft DW SH RS PA 
-89.034,32.1,LKCL/Lake Claude Bennett  TYPE:SP PH:601.727.3561   SITES:31  AMEN:WE NR  LON/LAT:-89.034/32.1,LKCL,Lake Claude Bennett,SP,601.727.3561, , ,31, ,WE NR 
-100.935,32.316,LAKE/Lake Colorado City State Park  TYPE:SP PH:325.728.3931 OPEN:all year  SITES:33 EL:2115 AMEN:E DP 45ft DW SH RS  LON/LAT:-100.935/32.316,LAKE,Lake Colorado City State Park,SP,325.728.3931,all year, ,33,2115,E DP 45ft DW SH RS 
-89.734,31.182,LKCL/Lake Columbia  TYPE:SP PH:601.736.1861   SITES:12  AMEN:WE NR  LON/LAT:-89.734/31.182,LKCL,Lake Columbia,SP,601.736.1861, , ,12, ,WE NR 
-84.65,34.861,LAKC/Lake Conasauga  TYPE:NF PH:706.638.1085/770.297.3000   SITES:35 EL:3146 AMEN:NH ND NS NR L$  LON/LAT:-84.65/34.861,LAKC,Lake Conasauga,NF,706.638.1085/770.297.3000, , ,35,3146,NH ND NS NR L$ 
-84.65,34.857,LAKO/Lake Conasauga Overflow  TYPE:NF PH:706.638.1085/770.297.3000   SITES:13 EL:3165 AMEN:NR  LON/LAT:-84.65/34.857,LAKO,Lake Conasauga Overflow,NF,706.638.1085/770.297.3000, , ,13,3165,NR 
-97.868,28.055,LACC/Lake Corpus Christi State Park  TYPE:SP PH:361.547.2635 OPEN:all year  SITES:116  AMEN:E DP 40ft DW SH RS L$  LON/LAT:-97.868/28.055,LACC,Lake Corpus Christi State Park,SP,361.547.2635,all year, ,116, ,E DP 40ft DW SH RS L$ 
-85.062,36.91,LAKC/Lake Cumberland State Park  TYPE:SP PH:800.325.1709 OPEN:early apr-late oct  SITES:150  AMEN:E DP DW SH RS PA  LON/LAT:-85.062/36.91,LAKC,Lake Cumberland State Park,SP,800.325.1709,early apr-late oct, ,150, ,E DP DW SH RS PA 
-98.872,32.648,LAKD/Lake Daniel City Park  TYPE:CP     EL:1301 AMEN:NH  LON/LAT:-98.872/32.648,LAKD,Lake Daniel City Park,CP, , , , ,1301,NH 
-92.491,32.783,LAKD/Lake DArbonne State Park  TYPE:SP PH:318.368.2086 OPEN:all year    AMEN:E DP DW SH RS PA  LON/LAT:-92.491/32.783,LAKD,Lake DArbonne State Park,SP,318.368.2086,all year, , , ,E DP DW SH RS PA 
-93.213,35.249,LKDC/Lake Dardanelle State Park  TYPE:SP PH:479.967.5516 OPEN:all year    AMEN:E DP DW SH RS  LON/LAT:-93.213/35.249,LKDC,Lake Dardanelle State Park,SP,479.967.5516,all year, , , ,E DP DW SH RS 
-81.786,29.431,LKDE/Lake Delancy  TYPE:NF PH:352.625.2520/850.523.8500   SITES:28  AMEN:NH ND NS NR  LON/LAT:-81.786/29.431,LKDE,Lake Delancy,NF,352.625.2520/850.523.8500, , ,28, ,NH ND NS NR 
-81.637,29.012,LKDO/Lake Dorr  TYPE:NF PH:352.669.3153/850.523.8500   SITES:59  AMEN:NH DW SH NR  LON/LAT:-81.637/29.012,LKDO,Lake Dorr,NF,352.669.3153/850.523.8500, , ,59, ,NH DW SH NR 
-81.866,29.252,LKET/Lake Eaton  TYPE:NF PH:352.625.2520/850.523.8500   SITES:22  AMEN:NH NR  LON/LAT:-81.866/29.252,LKET,Lake Eaton,NF,352.625.2520/850.523.8500, , ,22, ,NH NR 
-98.597,33.138,LAEL/Lake Eddleman City Park  TYPE:CP    SITES:22 EL:1081 AMEN:WE DP L$  LON/LAT:-98.597/33.138,LAEL,Lake Eddleman City Park,CP, , , ,22,1081,WE DP L$ 
-98.515,34.72,LAKE/Lake Elmer Thomas Military - Fort Sill  TYPE:MIL PH:580.442.5854  COMM:military only - do not use our lat/lon - contact them for directions and info   AMEN:E DP FT DW SH RS  LON/LAT:-98.515/34.72,LAKE,Lake Elmer Thomas Military - Fort Sill,MIL,580.442.5854, ,military only - do not use our lat/lon - contact them for directions and info, , ,E DP FT DW SH RS 
-91.188,29.72,LAKE/Lake End City Park  TYPE:CP PH:985.380.4623   SITES:74  AMEN:E DP DW SH  LON/LAT:-91.188/29.72,LAKE,Lake End City Park,CP,985.380.4623, , ,74, ,E DP DW SH 
-91.188,29.72,LAND/Lake End Park  TYPE:CP PH:985.380.4623   SITES:160  AMEN:E DP SH  LON/LAT:-91.188/29.72,LAND,Lake End Park,CP,985.380.4623, , ,160, ,E DP SH 
-91.188,29.72,LAKN/Lake End Park  TYPE:CP    SITES:167  AMEN:E DP DW SH  LON/LAT:-91.188/29.72,LAKN,Lake End Park,CP, , , ,167, ,E DP DW SH 
-91.608,30.062,LAKF/Lake Fausse Pointe State Park  TYPE:SP PH:337.229.4764 OPEN:all year    AMEN:E DP DW SH RS PA  LON/LAT:-91.608/30.062,LAKF,Lake Fausse Pointe State Park,SP,337.229.4764,all year, , , ,E DP DW SH RS PA 
-98.89,34.516,LAKF/Lake Frederick Park  TYPE:CP PH:580.397.7551   SITES:150  AMEN:WE DP DW SH  LON/LAT:-98.89/34.516,LAKF,Lake Frederick Park,CP,580.397.7551, , ,150, ,WE DP DW SH 
-90.716,35.972,LKFS/Lake Frierson State Park  TYPE:SP PH:501.767.9366 OPEN:all year    AMEN:E DW SH RS L$  LON/LAT:-90.716/35.972,LKFS,Lake Frierson State Park,SP,501.767.9366,all year, , , ,E DW SH RS L$ 
-94.159,35.649,LKFT/Lake Ft. Smith State Park  TYPE:SP  OPEN:all year    AMEN:E DP DW SH RS  LON/LAT:-94.159/35.649,LKFT,Lake Ft. Smith State Park,SP, ,all year, , , ,E DP DW SH RS 
-97.788,32.417,LAKG/Lake Granbury Marina and RV Park  TYPE:AUTH PH:817.573.3212     AMEN:E DP DW SH  LON/LAT:-97.788/32.417,LAKG,Lake Granbury Marina and RV Park,AUTH,817.573.3212, , , , ,E DP DW SH 
-81.951,34.195,LAKG/Lake Greenwood State Park  TYPE:SP PH:864.543.3535 OPEN:all year    AMEN:E DP DW SH RS PA  LON/LAT:-81.951/34.195,LAKG,Lake Greenwood State Park,SP,864.543.3535,all year, , , ,E DP DW SH RS PA 
-81.903,28.858,LKGR/Lake Griffin State Rec Area  TYPE:SP PH:352.360.6760 OPEN:all year    AMEN:WES DP 40ft DW SH RS PA  LON/LAT:-81.903/28.858,LKGR,Lake Griffin State Rec Area,SP,352.360.6760,all year, , , ,WES DP 40ft DW SH RS PA 
-86.203,34.401,LAKG/Lake Guntersville State Park  TYPE:SP PH:256.571.5444 OPEN:all year  SITES:366  AMEN:WES DP DW SH RS L$  LON/LAT:-86.203/34.401,LAKG,Lake Guntersville State Park,SP,256.571.5444,all year, ,366, ,WES DP DW SH RS L$ 
-83.028,34.493,LAKH/Lake Hartwell State Park  TYPE:SP PH:864.972.3352 OPEN:all year  SITES:125  AMEN:E DP 40ft DW SH RS PA  LON/LAT:-83.028/34.493,LAKH,Lake Hartwell State Park,SP,864.972.3352,all year, ,125, ,E DP 40ft DW SH RS PA 
-95.256,32.612,LAKH/Lake Hawkins County RV Park  TYPE:CP    SITES:50  AMEN:WES DP DW SH  LON/LAT:-95.256/32.612,LAKH,Lake Hawkins County RV Park,CP, , , ,50, ,WES DP DW SH 
-95.547,32.688,LAKS/Lake Holbrook Park - South  TYPE:CP   COMM:unknown facilities   AMEN:NH ND NS  LON/LAT:-95.547/32.688,LAKS,Lake Holbrook Park - South,CP, , ,unknown facilities, , ,NH ND NS 
-95.557,32.7,LAKW/Lake Holbrook Park - West  TYPE:CP PH:903.569.6351     AMEN:NH ND VT NW NS  LON/LAT:-95.557/32.7,LAKW,Lake Holbrook Park - West,CP,903.569.6351, , , , ,NH ND VT NW NS 
-95.158,30.142,LAHS/Lake Houston Wilderness Park  TYPE:CP PH:832.395.7000     AMEN:NH DW SH  LON/LAT:-95.158/30.142,LAHS,Lake Houston Wilderness Park,CP,832.395.7000, , , , ,NH DW SH 
-95.29,31.92,LAKJ/Lake Jacksonville Campground  TYPE:CP PH:903.586.8268   SITES:17  AMEN:WE DP DW SH  LON/LAT:-95.29/31.92,LAKJ,Lake Jacksonville Campground,CP,903.586.8268, , ,17, ,WE DP DW SH 
-81.907,35.732,LAKJ/Lake James State Park  TYPE:SP PH:828.652.5047 OPEN:early mar-late nov   EL:1248 AMEN:RS  LON/LAT:-81.907/35.732,LAKJ,Lake James State Park,SP,828.652.5047,early mar-late nov, , ,1248,RS 
-85.279,38.435,LAKJ/Lake Jericho Recreation Area  TYPE:UTIL PH:502.743.5205   SITES:62  AMEN:WES DP  LON/LAT:-85.279/38.435,LAKJ,Lake Jericho Recreation Area,UTIL,502.743.5205, , ,62, ,WES DP 
-81.38,27.969,LKKI/Lake Kissimmee State Park  TYPE:SP PH:863.696.1112 OPEN:all year    AMEN:E DP DW SH RS PA  LON/LAT:-81.38/27.969,LKKI,Lake Kissimmee State Park,SP,863.696.1112,all year, , , ,E DP DW SH RS PA 
-100.283,31.883,LAKE/Lake Knifrim County Park  TYPE:CP   COMM:unknown facilities   AMEN:E DP  LON/LAT:-100.283/31.883,LAKE,Lake Knifrim County Park,CP, , ,unknown facilities, , ,E DP 
-88.672,34.389,LCLA/Lake Lamar Bruce  TYPE:SP PH:662.869.2009   SITES:24  AMEN:WE SH NR  LON/LAT:-88.672/34.389,LCLA,Lake Lamar Bruce,SP,662.869.2009, , ,24, ,WE SH NR 
-93.76,36.435,LKLE/Lake Leatherwood City Park  TYPE:CP PH:479.253.7921    EL:1069 AMEN:WES  LON/LAT:-93.76/36.435,LKLE,Lake Leatherwood City Park,CP,479.253.7921, , , ,1069,WES 
-82.255,33.37,LAKL/Lake Leitner Military  TYPE:MIL PH:706.791.3317  COMM:military only - do not use our lat/lon - contact them for directions and info   AMEN:RS  LON/LAT:-82.255/33.37,LAKL,Lake Leitner Military,MIL,706.791.3317, ,military only - do not use our lat/lon - contact them for directions and info, , ,RS 
-90.341,31.673,LKLI/Lake Lincoln State Park  TYPE:SP PH:601.643.9044 OPEN:all year    AMEN:WES DP 45ft DW SH RS PA  LON/LAT:-90.341/31.673,LKLI,Lake Lincoln State Park,SP,601.643.9044,all year, , , ,WES DP 45ft DW SH RS PA 
-95.001,30.657,LAKL/Lake Livingston State Park  TYPE:SP PH:936.365.2201 OPEN:all year  SITES:160  AMEN:E DP SH RS L$  LON/LAT:-95.001/30.657,LAKL,Lake Livingston State Park,SP,936.365.2201,all year, ,160, ,E DP SH RS L$ 
-81.721,28.456,LKLO/Lake Louisa State Park  TYPE:SP PH:352.394.3969 OPEN:all year    AMEN:WES DP 70ft DW SH RS PA  LON/LAT:-81.721/28.456,LKLO,Lake Louisa State Park,SP,352.394.3969,all year, , , ,WES DP 70ft DW SH RS PA 
-88.303,33.427,LKLO/Lake Lowndes State Park  TYPE:SP PH:662.328.2110 OPEN:all year    AMEN:WES DP DW SH RS PA  LON/LAT:-88.303/33.427,LKLO,Lake Lowndes State Park,SP,662.328.2110,all year, , , ,WES DP DW SH RS PA 
-87.677,33.296,LAKL/Lake Lurleen State Park  TYPE:SP PH:205.339.1558 OPEN:all year  SITES:91  AMEN:WES DP SH RS  LON/LAT:-87.677/33.296,LAKL,Lake Lurleen State Park,SP,205.339.1558,all year, ,91, ,WES DP SH RS 
-101.437,34.55,LAMC/Lake Mackenzie Park  TYPE:UTIL    SITES:42 EL:3139 AMEN:WE DP SH  LON/LAT:-101.437/34.55,LAMC,Lake Mackenzie Park,UTIL, , , ,42,3139,WE DP SH 
-87.04,37.074,LAKM/Lake Malone State Park  TYPE:SP PH:270.657.2111 OPEN:all year  SITES:125  AMEN:E DW SH RS PA  LON/LAT:-87.04/37.074,LAKM,Lake Malone State Park,SP,270.657.2111,all year, ,125, ,E DW SH RS PA 
-82.349,27.475,LKMA/Lake Manatee State Park  TYPE:SP PH:941.741.3028 OPEN:all year    AMEN:E DP 60ft DW SH RS PA  LON/LAT:-82.349/27.475,LKMA,Lake Manatee State Park,SP,941.741.3028,all year, , , ,E DP 60ft DW SH RS PA 
-85.824,32.778,LAKE/Lake Martin Military  TYPE:MIL PH:256.825.6251  COMM:military only - do not use our lat/lon - contact them for directions and info   AMEN:RS  LON/LAT:-85.824/32.778,LAKE,Lake Martin Military,MIL,256.825.6251, ,military only - do not use our lat/lon - contact them for directions and info, , ,RS 
-100.181,35.886,LAMA/Lake Marvin  TYPE:NF PH:580.497.2143/505.346.3804   SITES:21 EL:2277 AMEN:NH ND VT DW NS NR L$  LON/LAT:-100.181/35.886,LAMA,Lake Marvin,NF,580.497.2143/505.346.3804, , ,21,2277,NH ND VT DW NS NR L$ 
-90.16,31.574,LKMA/Lake Mary Crawford  TYPE:SP PH:601.587.7853   SITES:20  AMEN:WE NR  LON/LAT:-90.16/31.574,LKMA,Lake Mary Crawford,SP,601.587.7853, , ,20, ,WE NR 
-87.856,37.615,LAKE/Lake Mauzy - Higgins-Henry WMA  TYPE:SFW  OPEN:all year COMM:Fish/Wildlife sites may have few facilitiies   AMEN:NH ND VT NS NR N$  LON/LAT:-87.856/37.615,LAKE,Lake Mauzy - Higgins-Henry WMA,SFW, ,all year,Fish/Wildlife sites may have few facilitiies, , ,NH ND VT NS NR N$ 
-95.814,35.033,LAKM/Lake McAlester  TYPE:CP PH:918.423.9300     AMEN:VT  LON/LAT:-95.814/35.033,LAKM,Lake McAlester,CP,918.423.9300, , , , ,VT 
-97.177,36.183,LAME/Lake McMurtry East  TYPE:CP PH:405.747.8085     AMEN:WE DP FT DW  LON/LAT:-97.177/36.183,LAME,Lake McMurtry East,CP,405.747.8085, , , , ,WE DP FT DW 
-97.188,36.17,LAMW/Lake McMurtry West  TYPE:CP PH:405.747.8085     AMEN:WE DP FT DW  LON/LAT:-97.188/36.17,LAMW,Lake McMurtry West,CP,405.747.8085, , , , ,WE DP FT DW 
-96.592,31.656,LAMX/Lake Mexia Rec Area  TYPE:UTIL    SITES:22  AMEN:WE DP DW SH  LON/LAT:-96.592/31.656,LAMX,Lake Mexia Rec Area,UTIL, , , ,22, ,WE DP DW SH 
-89.649,31.572,LKMI/Lake Mike Conner  TYPE:SP PH:601.765.4024   SITES:20  AMEN:WE NR  LON/LAT:-89.649/31.572,LKMI,Lake Mike Conner,SP,601.765.4024, , ,20, ,WE NR 
-98.042,32.815,LAMI/Lake Mineral Wells State Park  TYPE:SP PH:940.328.1171 OPEN:all year COMM:3 campgrounds SITES:105  AMEN:E DP 40ft SH RS  LON/LAT:-98.042/32.815,LAMI,Lake Mineral Wells State Park,SP,940.328.1171,all year,3 campgrounds,105, ,E DP 40ft SH RS 
-81.322,28.841,LKMO/Lake Monroe  TYPE:CP PH:386.668.3825     AMEN:E DP DW SH  LON/LAT:-81.322/28.841,LKMO,Lake Monroe,CP,386.668.3825, , , , ,E DP DW SH 
-88.565,33.946,LKMO/Lake Monroe  TYPE:SP PH:662.256.9637   SITES:20  AMEN:WE NR  LON/LAT:-88.565/33.946,LKMO,Lake Monroe,SP,662.256.9637, , ,20, ,WE NR 
-80.944,35.668,LAKN/Lake Norman State Park  TYPE:SP PH:704.528.6350 OPEN:mid mar-late nov  SITES:33  AMEN:NH DP FT DW SH RS  LON/LAT:-80.944/35.668,LAKN,Lake Norman State Park,SP,704.528.6350,mid mar-late nov, ,33, ,NH DP FT DW SH RS 
-94.696,32.842,LAKP/Lake Of The Pines  TYPE:COE PH:903.665.2336   SITES:30  AMEN:NR  LON/LAT:-94.696/32.842,LAKP,Lake Of The Pines,COE,903.665.2336, , ,30, ,NR 
-93.168,34.61,LKOU/Lake Ouachita State Park  TYPE:SP PH:501.767.9366 OPEN:all year    AMEN:E DP DW SH RS L$  LON/LAT:-93.168/34.61,LKOU,Lake Ouachita State Park,SP,501.767.9366,all year, , , ,E DP DW SH RS L$ 
-101.167,36.347,PALD/Lake Palo Duro  TYPE:UTIL PH:806.882.4401  COMM:unknown facilities   AMEN:E L$  LON/LAT:-101.167/36.347,PALD,Lake Palo Duro,UTIL,806.882.4401, ,unknown facilities, , ,E L$ 
-97.021,33.084,LAPL/Lake Park - Lewisville  TYPE:CP PH:972.219.3742     AMEN:WE DP DW SH  LON/LAT:-97.021/33.084,LAPL,Lake Park - Lewisville,CP,972.219.3742, , , , ,WE DP DW SH 
-88.905,31.133,LKPE/Lake Perry  TYPE:SP PH:601.784.6119   SITES:20  AMEN:WE DP NR  LON/LAT:-88.905/31.133,LKPE,Lake Perry,SP,601.784.6119, , ,20, ,WE DP NR 
-90.688,35.534,LKPS/Lake Poinsett State Park  TYPE:SP PH:870.578.2064 OPEN:all year    AMEN:E DP DW SH RS L$  LON/LAT:-90.688/35.534,LKPS,Lake Poinsett State Park,SP,870.578.2064,all year, , , ,E DP DW SH RS L$ 
-97.02,36.727,LAKP/Lake Ponca  TYPE:CP PH:580.767.0430     AMEN:E DP DW SH L$  LON/LAT:-97.02/36.727,LAKP,Lake Ponca,CP,580.767.0430, , , , ,E DP DW SH L$ 
-82.63,35.485,LAKP/Lake Powhatan  TYPE:NF PH:828.877.3265/828.257.4200 OPEN:early apr-late oct  SITES:97 EL:2195 AMEN:WES DP 45ft DW SH RS PA L$  LON/LAT:-82.63/35.485,LAKP,Lake Powhatan,NF,828.877.3265/828.257.4200,early apr-late oct, ,97,2195,WES DP 45ft DW SH RS PA L$ 
-95.447,32.858,LAKQ/Lake Quitman Park  TYPE:CP  OPEN:all year    AMEN:WE  LON/LAT:-95.447/32.858,LAKQ,Lake Quitman Park,CP, ,all year, , , ,WE 
-79.683,36.295,LAKR/Lake Reidsville Rec Park  TYPE:CP PH:336.349.4738     AMEN:E DP DW SH  LON/LAT:-79.683/36.295,LAKR,Lake Reidsville Rec Park,CP,336.349.4738, , , , ,E DP DW SH 
-89.592,31.832,LKRO/Lake Ross Barnett  TYPE:SP PH:601.733.2611   SITES:22  AMEN:WE NR  LON/LAT:-89.592/31.832,LKRO,Lake Ross Barnett,SP,601.733.2611, , ,22, ,WE NR 
-83.495,34.494,LAKR/Lake Russell  TYPE:NF PH:809.782.3320/770.297.3000   SITES:42 EL:1098 AMEN:NH DP DW SH NR  LON/LAT:-83.495/34.494,LAKR,Lake Russell,NF,809.782.3320/770.297.3000, , ,42,1098,NH DP DW SH NR 
-96.152,36.036,LASA/Lake Sahoma  TYPE:CP PH:918.227.1534     AMEN:WE  LON/LAT:-96.152/36.036,LASA,Lake Sahoma,CP,918.227.1534, , , , ,WE 
-85.221,38.231,LAKE/Lake Shelby Campground  TYPE:CP PH:502.633.5069   SITES:20  AMEN:E DP DW SH L$  LON/LAT:-85.221/38.231,LAKE,Lake Shelby Campground,CP,502.633.5069, , ,20, ,E DP DW SH L$ 
-83.395,33.208,LAKN/Lake Sinclair  TYPE:NF PH:706.485.3180/770.297.3000 OPEN:all year  SITES:61  AMEN:WES DP DW SH RS PA  LON/LAT:-83.395/33.208,LAKN,Lake Sinclair,NF,706.485.3180/770.297.3000,all year, ,61, ,WES DP DW SH RS PA 
-87.294,30.97,LKST/Lake Stone  TYPE:CP PH:850.256.5555     AMEN:E DP DW SH  LON/LAT:-87.294/30.97,LKST,Lake Stone,CP,850.256.5555, , , , ,E DP DW SH 
-100.303,32.441,LASW/Lake Sweetwater Park  TYPE:CP    SITES:20 EL:2070 AMEN:WE DP  LON/LAT:-100.303/32.441,LASW,Lake Sweetwater Park,CP, , , ,20,2070,WE DP 
-92.82,34.868,LKSY/Lake Sylvia  TYPE:NF PH:501.984.5313/501.321.5202 OPEN:mid apr-mid oct  SITES:27  AMEN:E DP DW NS NR  LON/LAT:-92.82/34.868,LKSY,Lake Sylvia,NF,501.984.5313/501.321.5202,mid apr-mid oct, ,27, ,E DP DW NS NR 
-95.994,32.842,LATA/Lake Tawakoni State Park  TYPE:SP PH:903.560.7123 OPEN:all year  SITES:78  AMEN:WE DP DW SH RS  LON/LAT:-95.994/32.842,LATA,Lake Tawakoni State Park,SP,903.560.7123,all year, ,78, ,WE DP DW SH RS 
-94.406,30.903,LATJ/Lake Tejas City Park  TYPE:CP PH:409.837.5757     AMEN:E  LON/LAT:-94.406/30.903,LATJ,Lake Tejas City Park,CP,409.837.5757, , , , ,E 
-96.547,28.955,LATE/Lake Texana State Park  TYPE:SP PH:361.782.5718 OPEN:all year  SITES:55  AMEN:WE DP DW SH RS L$  LON/LAT:-96.547/28.955,LATE,Lake Texana State Park,SP,361.782.5718,all year, ,55, ,WE DP DW SH RS L$ 
-96.638,33.997,LAKT/Lake Texoma State Park  TYPE:SP PH:580.564.2566 OPEN:all year    AMEN:E DP DW SH  LON/LAT:-96.638/33.997,LAKT,Lake Texoma State Park,SP,580.564.2566,all year, , , ,E DP DW SH 
-97.248,35.232,LAKN/Lake Thunderbird State Park - North  TYPE:SP PH:405.360.3572 OPEN:all year    AMEN:40ft  LON/LAT:-97.248/35.232,LAKN,Lake Thunderbird State Park - North,SP,405.360.3572,all year, , , ,40ft 
-97.239,35.202,LAKS/Lake Thunderbird State Park - South  TYPE:SP PH:405.360.3572 OPEN:all year    LON/LAT:-97.239/35.202,LAKS,Lake Thunderbird State Park - South,SP,405.360.3572,all year, , , ,
-88.528,32.422,LKTO/Lake Tom Bailey  TYPE:SP PH:601.632.4679   SITES:32  AMEN:WE DP DW SH NR  LON/LAT:-88.528/32.422,LKTO,Lake Tom Bailey,SP,601.632.4679, , ,32, ,WE DP DW SH NR 
-100.433,32.365,LATM/Lake Trammell Park  TYPE:CP PH:325.235.5191    EL:2269 AMEN:NH ND FT NS  LON/LAT:-100.433/32.365,LATM,Lake Trammell Park,CP,325.235.5191, , , ,2269,NH ND FT NS 
-89.209,31.208,LAKE/Lake Walker Military - Camp Shelby  TYPE:MIL PH:601.558.2397  COMM:military only - do not use our lat/lon - contact them for directions and info   AMEN:RS  LON/LAT:-89.209/31.208,LAKE,Lake Walker Military - Camp Shelby,MIL,601.558.2397, ,military only - do not use our lat/lon - contact them for directions and info, , ,RS 
-80.87,34.431,LAKW/Lake Wateree State Rec Area  TYPE:SP PH:803.482.6401 OPEN:all year  SITES:70  AMEN:E DP 40ft DW SH RS PA  LON/LAT:-80.87/34.431,LAKW,Lake Wateree State Rec Area,SP,803.482.6401,all year, ,70, ,E DP 40ft DW SH RS PA 
-94.37,36.092,LKWR/Lake Wedington Rec. Area  TYPE:NF PH:479.667.2191/479.964.7200 OPEN:all year  SITES:152 EL:1145 AMEN:E DP DW SH RS L$  LON/LAT:-94.37/36.092,LKWR,Lake Wedington Rec. Area,NF,479.667.2191/479.964.7200,all year, ,152,1145,E DP DW SH RS L$ 
-97.358,31.93,LAKW/Lake Whitney State Park  TYPE:SP PH:254.694.3793 OPEN:all year  SITES:158  AMEN:WE DP 40ft DW SH RS  LON/LAT:-97.358/31.93,LAKW,Lake Whitney State Park,SP,254.694.3793,all year, ,158, ,WE DP 40ft DW SH RS 
-83.97,34.739,LAKW/Lake Winfield Scott  TYPE:NF PH:706.745.6928/770.297.3000 OPEN:mid apr-mid nov  SITES:44 EL:2924 AMEN:WES DW SH RS PA  LON/LAT:-83.97/34.739,LAKW,Lake Winfield Scott,NF,706.745.6928/770.297.3000,mid apr-mid nov, ,44,2924,WES DW SH RS PA 
-95.356,32.918,LAWI/Lake Winnsboro North Park  TYPE:CP PH:903.763.2716 OPEN:all year  SITES:15  AMEN:E DP SH N$  LON/LAT:-95.356/32.918,LAWI,Lake Winnsboro North Park,CP,903.763.2716,all year, ,15, ,E DP SH N$ 
-97.496,29.472,LAWD/Lake Wood Rec Area  TYPE:UTIL PH:830.672.2779   SITES:25  AMEN:WES DP DW SH  LON/LAT:-97.496/29.472,LAWD,Lake Wood Rec Area,UTIL,830.672.2779, , ,25, ,WES DP DW SH 
-83.343,34.68,LAKY/Lake Yonah County Park  TYPE:CP PH:706.782.4014     LON/LAT:-83.343/34.68,LAKY,Lake Yonah County Park,CP,706.782.4014, , , , ,
-96.444,33.103,LALD/Lakeland - Lavon Lake  TYPE:COE PH:972.442.3141  COMM:tents only SITES:32  AMEN:NH ND NS NR  LON/LAT:-96.444/33.103,LALD,Lakeland - Lavon Lake,COE,972.442.3141, ,tents only,32, ,NH ND NS NR 
-85.114,31.988,LAKP/LakePoint State Park  TYPE:SP PH:334.687.8011 OPEN:all year  SITES:192  AMEN:WES DP DW SH RS  LON/LAT:-85.114/31.988,LAKP,LakePoint State Park,SP,334.687.8011,all year, ,192, ,WES DP DW SH RS 
-99.592,31.838,LAHO/Lakeside - Hords Creek Lake  TYPE:COE PH:325.625.2322 OPEN:all year  SITES:50 EL:1929 AMEN:WES DP DW SH RS  LON/LAT:-99.592/31.838,LAHO,Lakeside - Hords Creek Lake,COE,325.625.2322,all year, ,50,1929,WES DP DW SH RS 
-96.554,33.937,LASD/Lakeside - Lake Texoma  TYPE:COE PH:580.920.0176 OPEN:early apr-late sep    AMEN:E DP DW SH RS  LON/LAT:-96.554/33.937,LASD,Lakeside - Lake Texoma,COE,580.920.0176,early apr-late sep, , , ,E DP DW SH RS 
